,title,score,id,url,comms_num,created,body
0,"Award Travel: The bottleneck of churning, a rant after a year of non-stop traveling on points",69,95mhoc,https://www.reddit.com/r/awardtravel/comments/95mhoc/award_travel_the_bottleneck_of_churning_a_rant/,102,2018-08-08 18:30:16,"The following is a reflection of my frustration with award travel prompted by aksurvivorfan’s post [here](https://www.reddit.com/r/churning/comments/8xcnaa/discussion_frustrations_with_the_act_of_churning/) on their frustration with churning. Seeing as churning and award travel go hand-in-hand, this is also a word of warning for savy churners looking to transition into the next phase that is award travel. It’s not safe to assume the same success. The process of award travel is much more difficult.

My one year of traveling has come to a close. I haven’t traveled nearly as much as those who do it full-time, but I have spent more than two million miles on flights since 2017. This post is a reflection of some of the frustrations of the miles and points game that are often forgotten and omitted in posts on reddit and in the blogosphere. I went from being an avid fanatic of the hobby with barely any reservations to a huge critic of the many overlooked obstacles of award travel, especially the golden goose that is premium cabins that many, but not all of us, chase. After all, it was the first and business class redemptions rather than mileage currencies itself that got me and most of the people I know interested.

TL:DR: While churning and amassing a huge amount of points is relatively simple and straightforward (give or take the current rules in place and possible future restrictions), maximizing award travel can be quite the opposite, sometimes extremely time consuming and difficult to navigate.

I was introduced to the hobby in 2014 when, out of curiosity, I started looking up first class reviews. I stumbled across the blog, One Mile at a Time, and was blown away on how someone not much older than me was consistently traveling on first class tickets without travel benefits and little out-of-pocket expense. I finally was able to get my first “true” churning card in 2015 and since then have opened up several accounts.

But being both a full-time student and employee, meant that I had almost no time to travel. And when I did have time off, it was at most a week, two if I was lucky. This meant long haul travel was often out of the picture due to time lost in transit which brings me to frustration point #1:

1. You need time to travel.

Now I know most of you already know this as it’s nothing new. However, many of my friends who started with me in this hobby in 2015 are still sitting on the same treasure chest of points with a few redemptions but nothing significant enough to make a sizeable dent in their balance. The biggest constraint for them and many others was finding leave, which tends to be the reason why most people don’t want to do round the world awards that otherwise are one of the best bargains for miles in the business. My solution this past year was to no longer stay a full-time student and employee, which being young and without a family was an easier choice to make than most. But say you are able to find the time to travel, then you soon come to realize the next frustration point.

2.	Finding availability isn’t as easy with miles as with cash.

And this point here, tends to be a real deal breaker, especially if your time off often correlates to holidays when everyone else is off such as Thanksgiving, Christmas, and New Year’s. Or if it’s off-peak, but on an airline that only releases one business seat to partners (ie: Korean Air). Or there’s availability, but only far enough in advance (ie: Qantas or Air New Zealand), but too early enough to guarantee you’ll be authorized leave. Or like Cathay or Lufthansa First, where it requires you to be flexible enough to plan a week or two before your trip. Sometimes the airline is just plain stingy and doesn’t like to release award seats (IE: American Airlines on domestic routes). Another catch is that airlines don’t apply the same supply and demand algorithms to award availability that they do to the usual cash seats. Only a handful of award seats are allocated and then are released and restricted at varying times as you get closer to departure. Maybe it’s an oversimplification, but it’s usually an all or nothing type of ordeal. It goes from saver awards, to unaffordable standard awards, to no availability. Sometimes even in the reverse order.  It’s usually not the gradual change in pricing that you typically see with cash tickets.  Don’t even get me started on trying to find premium availability for parties greater than two. Sometimes you even have to find availability using another airline’s website (British Airways search using American Airlines), or there’s phantom availability, availability not searchable online (Alaska for Cathay), married segment availability (Qatar), and the list goes on and on. But say, you find the availability but as you’re piecing everything together online, an error message pops up. You call the airline up, feed the flights, only to find out your trip is significantly more expensive than expected or that the routing isn’t valid. Here we have frustration point #3.

3.	Your routing isn’t always valid even if it’s logical.

Oh boy does this require TONS of time and research. Especially if you’re trying to go for the real niche redemptions that can save you a bunch of miles. You have so many airline programs accessible with transferable currencies, multiplied by the amount of partners for each airline, and then some. This of course assumes that the airlines actually publish these rules yet alone follows them. Take for example the ninth circle of award redemption hell that is SkyTeam, save for Korean Air. The two most popular members, being Air France/KLM and Delta. Neither publish award charts to add to their already poor search engines. So you get awards that price out contrary to logic (IE: JFK-CDG-ZRH might be cheaper than JFK-CDG). My personal pet peeve is the maximum permitted mileage restriction since many of my routings to Europe require back-tracking by necessity not by choice. American likes to segment cap awards which really punishes those in small airports or prevents routing through third regions with certain exceptions. This is where United really shines, even with the introduction of the Excursionist perk/restriction, MileagePlus is still the most generous among the big three in terms of routing rules. I spent almost every day this past year researching on this topic, and every time I think I come close to mastering a program, I find something new or a program change renders some of my past knowledge obsolete. Say you cross all your t’s and dot all your I’s on your upcoming Etihad first itinerary. You find the time to travel, find the availability, and verify the cost and route validity. You can call American only to find out that they can’t book it nor find the availability. Thus, frustration point #4 is often overlooked.

4.	Booking awards isn’t always straightforward

The example above is caused by US based American Airlines agents being unable to see Etihad first availability, whereas certain call centers like Australia and New Zealand are able to find and book your request. But sometimes it’s not even technical issues like that. YMMV even with the CS reps themselves, especially with one of the off the beaten track currencies like Turkish. One of the top posts on r/awardtravel outlines the process in booking a second first class JAL award seat and it’s a great example of frustration points #2 and #4. It’s great to see how some of the top posts in award travel help breakdown these processes in simple and easy to follow steps to make frustration point #4 much more straightforward. It doesn’t help that airlines love to tack on fees during the booking process: fees for booking close to departure, booking over the phone, booking on partners, etc. In the end, all these fees (sometimes avoidable, not always) make award travel not as free as it’s hyped up to be. I’m sure you can figure out our next frustration point, since people love to advertise award travel as free travel.

5.	Award travel isn’t free and neither are miles.

There are tons of clickbait titles and misleading propaganda on blogosphere and especially YouTube vlogs about how they scored a $XXXXX flight for $5 as the main point rather than the amount of miles used to book the flight. Miles are definitely not free and even if someone offered to cash out my entire point balance at a generous 2 cents per point, I’d still feel short changed. There’s so many rules in regards to taxes and fees yet sometimes the only way you find out is at the final step of the booking process. Taxes and fees vary depending on the currencies used and the airlines redeemed and navigating these can be a huge headache. So while I can redeem 230K United Airlines miles for a roundtrip between HND-FRA in ANA first class for “only” $120, most people would agree that 93K AMEX points with a 30% transfer bonus to Virgin Atlantic with $375 in surcharges is a much better redemption. So no, one doesn’t redeem first class ANA for just “$120”. Props if you’ve read this far, as we’ve finally reached the final frustration point.

6.	Information on award travel is not as readily blogged as churning information or trip reports.

I think it’s a shame that there’s more focus on how to accrue points than on how to spend them. At first, this confused me, especially when the latter is much more difficult. What’s the point of churning if you can’t reap the rewards effectively? The cold truth is that blogs and referrals receive commissions on the amount of credit card sign ups, not the amount of award redemptions. In fact, many blogs also profit by offering award booking services so having everyone informed, would be a loss of another revenue stream. I only started browsing flyertalk once I needed information for award redemptions since information on churning is readily available, at times over saturated. For example, there are tons of posts advertising IHG credit cards and how Intercontinental Thalasso is a great redemption of IHG points! $1,000 vs 70K IHG points, 1+ cpp! But there are almost no posts anywhere regarding how to successfully book award nights, even on flyertalk where it becomes obvious it’s a closely guarded secret. There’s a huge discrepancy of information between r/churning and r/awardtravel, and while I think doctorofcredit is the best resource for churning, there’s clearly not as much information on the website for award travel.

In the end, award travel may not be as much of a glorified hobby compared to churning due to its difficulty, but it’s definitely just as important. In fact, I still hesitate pitching churning to certain people who can easily accrue points and succeed in the hobby, but don’t know anything about award travel. There’s little use in collecting a huge sum of points yet unable to redeem them, only for them to be devalued year after year.

I know it might seem like I'm just a cynic and anti-award travel, but I certainly still support this hobby just hopefully with a little more research and awareness from current and upcoming churners.

EDIT 1: Changed point 6 from information not as readily available, not information not as readily blogged."
1,Which airline to build elite status with?,24,9e6f2s,https://www.reddit.com/r/awardtravel/comments/9e6f2s/which_airline_to_build_elite_status_with/,75,2018-09-08 22:39:58,"I travel a lot for vacation and my s.o. is a flight attendant so I take a lot of random long haul flights out of the country.  I'm thinking that it's time to build elite status with an airline, but I don't know which one.  

Any recommendations?  

I've flown Delta and United before and I've been more impressed with Delta, but I'm located in NJ which means I mostly fly out of Newark (a United hub) and I don't really like how AmEx is declined everywhere.  American seems to have the best credit card at the moment with 2x points on dining and gas."
2,The 3 Card Las Vegas Weekend,13,4of6m8,https://www.reddit.com/r/awardtravel/comments/4of6m8/the_3_card_las_vegas_weekend/,73,2016-06-16 23:32:27,"##The 3 Card Las Vegas Weekend
June 16, 2016

I wanted to share a Las Vegas long weekend trip I just booked when the opportunity came up.  This is something most people can do with a bit of planning and time.  I structured the write-up around a single churner applying for 3 cards.  If you are churning for two, the same trip can be done more efficiently with 4 cards.  You do have to hold one of the cards for more than 1 year, and pay a $49 annual fee.

### The Cards involved

- Chase Sapphire Preferred/Chase British Airways (30K UR/Avios)
- AmEx Starwood Preferred (20K SPG Starpoints)
- Chase IHG (60k IHG AND 1 Annual Free Night after 1 year)

### Booking the Trip

The genesis of the trip was a SPG Moments offer: for 20K SPG points, you can get premium seats for two at a concert at Caesar’s Palace.  This was something we were looking to do over the summer, so having it pop-up was perfect.  It’s unclear what “Premium” seats mean, but decent seats for the concert runs $2-300 per ticket.  So the 20K SPG points is redeeming for something between $4-600 in value.  Flyertalk search showed one report of the seats being in the 8th row, which would indeed be pretty good seats.

**UPDATE** SPG has gotten back to me with the seats.  They are in the orchestra section, and tickets for that section are going for $430 a piece.  So the 20K SPG points bought $860 worth of tickets. 

Las Vegas hotels discounts heavily on a regular basis, so folks often find the best value by just booking a discount rate.  When I started looking at hotels, I start with awardmapper.com.  None of the rates really looked appealing, but as I looked deeper, the Venetian and Palazzo are Intercontinentals, and award nights is priced at 60K.  This means that 2 nights there would be 60K IHG points for the first night, and an annual free night certificate (second night) if you hold the IHG card for a year and pay the $49 AF.  The better plan would be using two annual free night certificates, which I happen to have available.  Booking this was very easy, just login into your IHG account, and use the Book Free Night functionality.  When I looked, the rate per night is $300 at the Palazzo.  So signing up for the IHG card, paying the AF of $49 for the second year, will redeem for a value around $600.  Note, even if the hotel discounts 50%, you are still looking at a $300 redemption.  BTW, I found out afterwards that the hotels are all suites, with 720 sq ft in their standard rooms.  There is a $32 per night Resort fee that needs to be paid on award stays as well, but rumour is that there is a way to get out of it.  Reports also show that IHG Platinum and Spire Elites status means little to nothing at these hotels, so don’t expect an upgrade based on these statuses.  Royal Ambassador does get the expected recognition.

Last step, how to get to Las Vegas.  From Seattle to Las Vegas is just under 1,000 miles, which means if I redeemed Avios from a Chase BA card, or transfer points from UR to Avios, I would spend 30K points for two RTs.  To book, I would use AA.com, and search for awards costing 12.5K AA miles.  I can find award flights on Alaska Air at that redemption cost for both days, and write down the flight numbers.  I would then call BA directly, and booked these flights, as you cannot book Alaska awards on BA.com.  I did all these searches, and seats were available, but the timing of the return flight was atrocious, something to be aware of when looking at award flights.

Note that I describe how it can be done with a CSP or BA Avios card.  In my case, I chose to save my points.  The actual flights at more preferred times on this trip cost about $200 per person.  I also have an Alaska Air companion pass from the Alaska Air card, which makes the 2 RTs cost around $340.  As I value 30K of Avios/UR more than $340, I decided it was more valuable for me to save the points and pay for the flights.  This is purely a personal decision, and only you can decide whether paying for the flights, or using points is a better deal.

Now, what if Alaska air is not a useful redemption from where you live?  The Chase UR points can be transferred to United or Flying Blue, and you can redeem United or Delta award flights.  If your preferred airline is Southwest, then a Chase Southwest card with the 50K sign-up bonus, would very likely get two of you to Vegas with 1 card.  If you get the Companion Pass, it would further halve the cost.

### Takeaways

First of all, this is a pretty simple redemption.  Other than the BA award, you can do everything online.  Secondly, with just 3 cards, you can get a nice little weekend getaway without having to worry about MS or other complexities, and you will likely have some points leftover.  The only gotcha is that you need to get the IHG card, and hold it for a year to get the free annual night.  The ability to redeem at almost all IHG properties make the $49 AF an absolute bargain if you plan any IHG hotel stays over the course of a year.

Next, SPG Moments offer a different dimension on how to use points.  Other than just free nights or airline tickets, you can get some pretty interesting redemptions, such as boxed seats to sporting events, concerts tickets, or even mingling with players at a ball park.  This alone is a pretty good reason to keep on channeling un-bonused spend onto the AmEx SPG card.

Lastly, point valuation is very personal.  Some folks value getting as many free trips as possible, while some may see points as opening doors to premium travel that you wouldn’t really want to pay for in cash.  There is no right answer here.  Whatever works for you, is the best answer.  
"
3,Chase Ultimate Rewards? Why is everything more expensive?,33,ayl4wy,https://www.reddit.com/r/awardtravel/comments/ayl4wy/chase_ultimate_rewards_why_is_everything_more/,77,2019-03-08 05:39:53,"I've been a Chase Sapphire preferred holder since the card was first introduced.  I've tried several times to book trips on there while getting the value for my points and it's rather frustrating.    


Tonight I was looking at flights to Hawaii and a few things jumped out at me (also please note it's been this way for a dozen plus trips I've tried to book with them):  
1) Prices are about $50 higher than booking with the airline directly, that fluctuates a little by airline but generally its about $50/ticket each way, I prefer to book united and they were $52 more expensive.

2) On top of being more expensive I am unable to select my fare, so it's Economy Basic, which might be ok, but I prefer regular Economy which allows for carry-on.  Traveling with the wife and two kids one or two carry on bags will be necessary.  

3) Rental cars and hotels are the same way, the markup on rental cars is just ridiculous.  20-40% depending on the company.    


I could transfer points direct to United and wait for deals, but that's tough with a family and coordinating schedules in a manner that's best for school so that's not really practical for me.    


Now it is true that with my 25% points savings, booking through Chase is about 14% cheaper than booking through united, but it should be 25%.  I'm basically saving a negligible amount on travel.    


The final point I'll make, is booking through Expedia, or another similar site savings significantly more than booking with the credit card through UR or other method.    


Anything else I can do?  If the travel awards simply aren't worth it, it may be time to find a better card and just focus on Cashback.  "
