,title,score,id,url,comms_num,created,body
133,Airbus at PAE?,3,25vn5j,https://www.reddit.com/r/aviation/comments/25vn5j/airbus_at_pae/,1,2014-05-18 22:35:19,"I was up at Paine Field yesterday and there was an aircraft in a canvas looking hanger, all you could see was the tail but it was painted in JetBlue colors and i thought JetBlue only ran Airbus's. is there a reason an Airbus would be there because i thought that place was all Boeing?   "
134,"JetBlue Airways built a makeshift ""Costco"" in Puerto Rico for it's employees to get food, drinks and other household products for free!",19,74jydr,https://thepointsguy.com/2017/10/jetblue-care-center-sju/,0,2017-10-06 03:49:38,
135,"In this article about Virgin America's IPO, it suggest how a buyout by JetBlue could benefit the company. Thoughts? Sounds like an amazing idea to me.",1,2d1l0z,http://www.fool.com/investing/general/2014/08/03/virgin-america-ipo-is-this-the-next-great-airline.aspx,0,2014-08-09 07:53:00,
136,Photo of JetBlue's Inaugural arrival into MDE (Medellin Colombia) that I captured,11,1gjcel,http://imgur.com/Jl2ruMp,0,2013-06-18 00:06:55,
137,Spotting Log I've Been Keeping,6,7iiqd7,https://www.reddit.com/r/aviation/comments/7iiqd7/spotting_log_ive_been_keeping/,0,2017-12-09 01:59:00,"I didn't know what better subreddits there were to post this to, so I'll give this one a shot. I've been keeping a log of the planes I've spotted from my house (unless otherwise noted) on a document on Google, and wanted to share it with some people. Some of the highlights on it are an Atlas Air Boeing 747 I spotted without a flight radar after getting a haircut, a JetBlue Airbus A320 with an NYPD livery, and others. I also kept details on registration, date of delivery, exact configuration, flight route, and what airlines the aircraft has served, assisted by a flight radar and a planespotting database. Any suggestions on improvement are welcome!

https://docs.google.com/document/d/1PT6NYJJIEwK_5KdvTwIFTTExd3LfHOhHrZqhvwiwMMw/edit"
138,jetBlue Embraer E190 - pretty one,1,2dvi8s,http://www.jetphotos.net/viewphoto.php?id=7871550,0,2014-08-18 14:45:43,
139,JetBlue a320 ready to depart SXM,5,2xz8op,https://www.flickr.com/photos/photosbybensenior/16719692385/,0,2015-03-05 05:31:54,
140,JetBlue pilots have voted to unionize with ALPA today,5,23pbrw,http://investor.jetblue.com/phoenix.zhtml?c=131045&p=irol-newsArticle&ID=1920746&highlight=,0,2014-04-22 23:17:57,
141,CS-TFY (formerly jetBlue N548JB) back at her old home at JFK,10,9375er,https://i.redd.it/qu8t77xiz4d11.jpg,0,2018-07-30 23:26:43,
142,Manhattan island from jetBlue A320 (396 ATL-BOS),10,cfug8h,https://i.redd.it/jsdo5ypuokb31.jpg,0,2019-07-21 07:04:53,
143,Russian airline Transaero signs partnership with JetBlue,4,1p32y4,http://allplane.tv/russia-airlines-aviation/2013/10/24/transaero-partnership-jetblue-on-russia-us-routes,0,2013-10-24 03:11:39,
144,JetBlue Gateway Select 2018,1,97ly6a,https://www.reddit.com/r/aviation/comments/75iu0s/jetblue_gateway_select_program_details/,0,2018-08-16 00:54:06,
145,"Welcome to Albuquerque, JetBlue! And also a few other planes.",0,1cwulx,https://www.reddit.com/r/aviation/comments/1cwulx/welcome_to_albuquerque_jetblue_and_also_a_few/,0,2013-04-23 07:15:07,"April 22nd, 2013. Waiting at KABQ/Kirtland AFB for the arrival of JetBlue's inaugural flight from JFK. Unfortunately, due to the terrible availability of places to watch from, I was unable to capture the water cannon salute. Oh well, here's the [album](http://imgur.com/a/31Mkn). Also, I was able to identify every commercial plane I saw but I was unable to see registration numbers for the V-22 and the C-130. Hope you enjoy!"
146,GoPro JetBlue Flight Boston to Orlando,1,2cmg13,http://youtu.be/QIosseiq2yA,0,2014-08-05 00:49:22,
147,"JetBlue to ""anchor"" new South Terminal @ MCO beginning in 2021",1,8k9dj4,http://www.orlandosentinel.com/business/tourism/os-orlando-airport-jet-blue-20180516-story.html,0,2018-05-18 05:10:28,
148,"JetBlue's tribute to Puerto Rico, ""Bluericua"", in Puerto Rico.",11,cp5nig,https://i.redd.it/7ntrzwfaaxf31.jpg,0,2019-08-12 05:43:00,
149,new jetBlue Veterans' plane getting a water canon salute,5,2lv7hk,http://i.imgur.com/sZNQQXB.jpg,0,2014-11-10 18:46:01,
150,Takeoff from Orlando via Jetblue,0,zzpaw,http://youtu.be/wEkgQJBk6Q4,0,2012-09-17 02:24:09,
151,One of JetBlue’s latest tails.,2,dasx3a,https://www.jetphotos.com/photo/9459068,0,2019-09-29 13:18:24,
152,I think Emirates might be announcing a new route to Chicago soon..,1,nz0m6,https://www.reddit.com/r/aviation/comments/nz0m6/i_think_emirates_might_be_announcing_a_new_route/,0,2012-01-02 01:46:14,"I'm suddenly seeing tons of local ads from them talking about how they're buying tons of (Chicago-headquartered) Boeing jets, and encouraging us to 'Fly Emirates,' even though there is (currently) no direct flight from Chicago--best option would be a Jetblue codeshare to JFK connecting to the Emirates flights there."
153,JetBlue Airways A320 in NYPD livery! [JFK Airport],10,8s5cj6,https://i.imgur.com/ytD7Zzu.jpg,0,2018-06-19 06:33:57,
154,JetBlue pilot ruled fit to stand trial.,1,v936i,http://www.cnn.com/2012/06/15/travel/jet-blue-pilot-competency/index.html?hpt=ju_t4,0,2012-06-19 04:44:49,
155,Little bit of spotting at Cibao International 4/2,2,4e6kxt,https://www.reddit.com/r/aviation/comments/4e6kxt/little_bit_of_spotting_at_cibao_international_42/,0,2016-04-10 21:08:19,"I took some pictures while waiting for my DELAYED flight on 4/2/16 from my Samsung S6. Nothing great, just pictures from when planes landed every-so-often. 
http://imgur.com/a/0ZbFR
I was flying from Santiago, Dominican Republic (STI) to New York's JFK airport on jetBlue flight 636, on an Airbus A320, N653JB."
156,JetBlue Flight Diverted After Bomb Threat,2,qt9wy,http://skylinenewsroom.com/2012/03/12/jetblue-flight-diverted-after-bomb-threat/,0,2012-03-12 23:01:47,
157,A JetBlue E190 at JFK. Saw many of these when I went spotting recently,14,cixd9x,https://i.redd.it/z2ygt8w3f2d31.jpg,0,2019-07-28 19:46:27,
158,Got a shot of this JetBlue A320 (N746JB) in New York Jets livery!,9,dnnjrd,https://i.redd.it/dc65lom5wzu31.png,0,2019-10-27 06:31:19,
159,GoPro JetBlue Flight Buffalo to Boston,2,2bhbif,http://youtu.be/ZeDDu1QyxE8,0,2014-07-23 13:17:10,
160,JetBlue pilot Clayton Osbon's unraveling baffles friends,0,rjdzf,http://www.csmonitor.com/USA/Latest-News-Wires/2012/0329/JetBlue-pilot-Clayton-Osbon-s-unraveling-baffles-friends,0,2012-03-29 20:06:12,
161, Is JetBlue Airways the No. 1 target of American Airlines?,4,xs4d8,http://aviationblog.dallasnews.com/2012/08/unsubstantiated-rumor-time-is-jetblue-airways-the-no-1-target-of-american-airlines.html/,0,2012-08-06 23:26:40,
162,Check out the name on this one. Lol. You just gotta love Jetblue!,0,7ux69i,https://www.jetphotos.com/photo/7742641#modal-share,0,2018-02-03 07:18:57,
163,JetBlue Captain's 'Freak Out' Diverts Flight ,2,riwwe,http://online.wsj.com/article/SB10001424052702303404704577307860387649158.html,0,2012-03-29 10:41:53,
164,JetBlue to unveil new tail design,7,2haada,http://jansaviation.com/news.php?art=jetblue-to-unveil-new-tail-design,0,2014-09-24 05:06:32,
165,"JetBlue’s Family Reunion (A320, E190, A321) then back to business as usual",6,9qty8i,https://i.redd.it/0hkgvmvnj0u11.jpg,0,2018-10-24 02:41:03,
166,JetBlue low departure over Maho Beach,0,afo0ap,http://www.airliners.net/photo/JetBlue-Airways/Airbus-A320-232/4222431?,0,2019-01-14 00:16:56,
167,"Face to Face, JetBlue E190. BOS-BUF.",25,84ulcf,https://i.redd.it/eyrs53ecx3m01.jpg,0,2018-03-16 15:01:35,
168,JetBlue E190 Final into JFK 31L late this afternoon,129,5ccrvq,https://i.redd.it/e49pn85rbxwx.jpg,0,2016-11-11 08:09:01,
169,JetBlue’s A321s To Offer 'Mini-Suites' In Business,6,1fuy3o,http://www.aviationweek.com/Article.aspx?id=/article-xml/avd_06_07_2013_p01-02-585989.xml,0,2013-06-07 17:16:26,
170,JetBlue job losses in a largest-ever restructuring,0,91uphc,http://aer24.co.uk/2018/07/25/jetblue-job-losses-in-a-largest-ever-restructuring/,0,2018-07-25 22:57:45,
171,Sunrise this morning from a JetBlue E190,42,954pgc,https://i.redd.it/8x7hzigh5je11.jpg,0,2018-08-07 00:09:19,
172,jetBlue Pilots Vote to Join Union,5,23padl,http://www.businessweek.com/news/2014-04-22/jetblue-pilot-vote-ends-status-as-biggest-nonunion-u-dot-s-dot-airline,0,2014-04-22 23:04:51,
