,title,score,id,url,comms_num,created,body
0,JetBlue gear up landing yesterday in NAS/MYNN,423,4c1a62,https://youtu.be/5O8ItM_C_NY,136,2016-03-26 18:10:55,
1,JetBlue Gateway Select Assessment help,1,af1w4t,https://www.reddit.com/r/aviation/comments/af1w4t/jetblue_gateway_select_assessment_help/,82,2019-01-12 03:18:54,"Hello everyone,  
I have applied to the Gateway Select program for JetBlue and have been selected to take their assessment. This is directed to those that have completed the program, are in the program currently, or have taken the test itself.  What exactly can I expect from the assessment?  Is it more aviation related or is it more general education related (like ACT/SAT.) I have done a lot of research on the program itself and for me the costs are not going to be (that) much of an issue. But I want to ensure that I do well on this assessment.  If anyone has any information for me (or even some practice tests that I could take) that would be absolutely fantastic and very much appreciated!  Thank you so much in advance.  
\*I will be checking regularly and responding to comments quickly\*

Edit: post was locked and archived so I will be moving this thread to  r/jetblue if you have any questions or just want to talk head there!"
2,That JetBlue flight that landed with the nosewheel sideways (pic).,231,23ung0,http://upload.wikimedia.org/wikipedia/commons/thumb/a/a3/JetBlue292Landing.jpg/800px-JetBlue292Landing.jpg,70,2014-04-24 15:35:51,
3,Jetblue orders 30 A321s for 3.6 Billion.,126,4uqcy0,http://www.al.com/news/index.ssf/2016/07/mobiles_airbus_site_grabs_chun.html,44,2016-07-26 23:10:10,
4,JetBlue's What's Old Is Blue Again Retro Livery here at LGA. 11/14/16,432,5d1wzh,https://i.reddituploads.com/d0021e7c63084645829e82a07e384640?fit=max&h=1536&w=1536&s=76a3e8251d1f3c415fe1092f7b86da65,43,2016-11-15 13:50:40,
5,Jetblue gateway select program details,3,75iu0s,https://www.reddit.com/r/aviation/comments/75iu0s/jetblue_gateway_select_program_details/,39,2017-10-10 21:56:51,"This post will detail my experience with the application process (and hopefully even further).

Found out about gateway select earlier this year, couldn't find much info on the process as I researched (found two helpful posts on r/flightsim and r/flying). Obvi it started in 2016 so there isn't much info to be found other then what's on the web page (http://pilots.jetblue.com/gateway-select/training). 

Submitted my application, resume, and cover letter Sept 24 2017.
Received an email on Oct 4 stating I've been selected for the next round of the application process.
This involved signing up for a $160 aptitude test at a testing center and to have the test completed by Oct 15. Just returned from that test and decided to make this post as I went in to it blind. You've got three hours and 4 test segments:

1. Multitasking: watch and interact with a flight sim, with limited direction on what the test comprises of. Keep track of audio directions (and how many individuals give you those directions), keep track of how many times there is a chiming noise, keep track of how many times a red light turns on. You also will have to click a button everytime you see air traffic or pass over a waypoint (you will be asked at what point you saw the helicopters and what the last way point looked like). While all this is happening you use the up and down arrows in a mini-game where you navigate a plane past oncoming rectangles. AND you have a few seconds to assess and answer quick math, spacial reasoning, and pattern recognition questions. The Sim ends and you answer the questions about how many chimes and how many people, what the last check point looked like, how many aircraft you saw, where in the route was the airfield, what the cockpit looked like and where the guages were. You make an assesment of how hard all that was and rate yourself on how well you did. Then you do the sim again. Slightly different, except this time you know what you're looking for.

2. Math, spacial reasoning, and pattern recognition:
Worst math was an algebra question (something like, (y-12)÷14=9). Spacial reasoning and pattern recognition are timed events, gotta be quick to answer or it counts as wrong.

3. Reacting to confrontation:
Questions like ""you see a couple arguing, the woman is trying to get away but the man has a hold of her arm and keeps pulling her back. Do you A B C or D?"" All the questions were how you'd react in a confrontation either involving you or getting involved with others.

4. Personality test:
Basic personality test. Questions like ""I work well with others."" ""Individual performance is more important then group success."" Strongly agree, agree, neutral, disagree, or strongly disagree.

The test results come back same day via email.

Next up will be a phone interview if they like the test results.
After that is an in person interview.

Will post as I move thru the process. 
This is an informative post about the process; discussions on program details and cost exist on other threads. Have not seen anything detailing NDA on what the test is made of. Dm me if this violates any policy that may jepordise my applicant eligibility.

(Fist post on Reddit, ever. Plz dm any tips/criticisms/correct place to post)

Written on mobile"
6,"I don't know what it is, but I just love pushing planes. Here is a jetBlue A320",245,1fcomt,http://i.imgur.com/AzeNYrj.jpg,37,2013-05-30 22:34:26,
7,JetBlue Emergency Flight Track and ATC Audio,30,vdv3x,http://www.avweb.com/avwebflash/news/Jetblue_emergency_hydraulic_vegas_jfk_Ntsb_206854-1.html,34,2012-06-21 19:27:15,
8,JetBlue Cessna 150 Emergency Landing,113,6eghqs,https://i.redd.it/oid944hgev0z.png,28,2017-05-31 21:28:03,
9,"JetBlue pilot flips out, is subdued by the passengers",52,rglt9,http://www.nydailynews.com/new-york/jetblue-flight-jfk-airport-diverted-pilot-flips-article-1.1051575?localLinksEnabled=false,28,2012-03-28 03:05:14,
10,Jetblue 1416 - number 2 engine troubles - passenger video,17,2gu4r9,https://www.youtube.com/watch?v=SPuTOEfzbGE,24,2014-09-19 09:40:07,
11,Daily Airline Discussion: jetBlue Airways,36,5dtkmt,https://imgur.com/a/mB2iD,22,2016-11-19 20:48:45,
12,"JetBlue orders 60 Airbus A220-300, with options for 60 more",38,8xt65p,http://blueir.investproductions.com/investor-relations/press-releases/2018/07-10-2018-211604881,21,2018-07-11 00:50:52,
13,JetBlue Fleet Overview,77,45xs8k,http://i.imgur.com/V2XG0Z0.png,21,2016-02-15 21:09:11,
14,JetBlue Is Training Pilots Without Any Previous Flying Experience,1,55v5rc,https://skift.com/2016/10/03/jetblue-is-training-pilots-without-any-previous-flying-experience/,20,2016-10-04 23:04:13,
15,JetBlue's route to FLL today,189,4hxuwf,http://imgur.com/Ihe1Pq4,20,2016-05-05 05:55:48,
16,How CNN made a fool out of themselves with Jetblue 94's near miss incident,25,2ubd8q,https://www.reddit.com/r/aviation/comments/2ubd8q/how_cnn_made_a_fool_out_of_themselves_with/,18,2015-01-31 19:33:48,"http://www.cnn.com/videos/tv/2015/01/31/nr-sot-valencia-jetblue-narrowly-misses-small-airplane.cnn

Mirror: http://www.msn.com/en-us/news/video/cockpit-audio-from-jetblues-near-miss-with-plane/vi-AA8OwRK?refvid=AA8FNNL

ATC recording => cockpit recording

Radio blocking => collision warning system



Not to mention the horrifying captions...

VFR traffic => via traffic

in sight => inside

Jetblue => Deborah !?!??!?!!?!?!??!?


I'm done with CNN.

Edit: Mirror thanks to /u/zeruela"
17,"JetBlue, American, Delta capped ticket prices out of Florida at $99 ahead of Hurricane Irma",0,8tnhsd,https://finance.yahoo.com/news/jetblue-caps-ticket-prices-florida-99-ahead-hurricane-irma-173232462.html,17,2018-06-25 07:50:25,
18,JetBlue plane makes emergency landing without nose gear in Bahamas,154,4c2cvw,http://i.imgur.com/f0YQKi7.gifv,17,2016-03-26 22:53:11,
19,JetBlue Shakes Up Pilot Hiring by Training Them From Scratch,15,3ualhr,http://www.bloomberg.com/news/articles/2015-11-25/jetblue-to-shake-up-hiring-on-start-from-scratch-pilot-training,17,2015-11-26 04:59:11,
20,"JetBlue flight loses 2 hydraulic systems, had to circle for 4 hours to burn fuel.  TIL A320s (and 737s) can't dump fuel.",9,vc3p7,http://www.foxnews.com/us/2012/06/20/mechanical-failure-reportedly-sends-jetblue-flight-careening-through-skies/,16,2012-06-20 20:58:08,
21,I'll see your Frontier animal names and raise you jetBlue's dad-pun aircraft names.,46,3bs3e5,http://www.planespotters.net/Airline/JetBlue-Airways,16,2015-07-01 22:20:48,
22,"Which is a better experience: jetBlue Mint LAX-JFK, or jetBlue Mint JFK-LAX?",5,327kmc,https://www.reddit.com/r/aviation/comments/327kmc/which_is_a_better_experience_jetblue_mint_laxjfk/,16,2015-04-11 11:09:50,"That might seem like a weird question with an obvious answer -- it's the same airline and the same route, so of course the two experiences would be the same, right? -- but hear me out.

I've always wanted to try out jetBlue's Mint service since I've heard and seen so much about it, but I never had the opportunity to do so until now. I will be traveling cross-country for business in June, and have the option of starting from JFK or from LAX. The problem is that I can only afford to fly Mint on one leg of the journey. Hence, my dilemma.

That is why I ask: all else being equal, which experience would be better: flying jetBlue Mint from JFK to LAX, or from LAX to JFK?


_Updated to add:_ I did it! And you were absolutely right; JFK-LAX on Mint was worth it. The service was very very nice. I am going to be flying Mint on that route from here on out, if I can afford to.

Thanks /u/coasterjake and /u/bretthull!"
23,Virgin America Gets Takeover Bids From JetBlue and Alaska Air,29,4cbtac,http://www.bloomberg.com/news/articles/2016-03-28/virgin-america-said-to-attract-jetblue-alaska-air-takeover-bids,13,2016-03-28 23:48:59,
24,A JetBlue A320 makes an emergency landing at LAX after a front landing gear failure ,29,19e7lc,http://upload.wikimedia.org/wikipedia/commons/3/36/JetBlue292Landing3.jpg,13,2013-02-28 16:33:32,
25,Airbus a321 flying JetBlue claims we reached 799mph,0,b11251,https://www.reddit.com/r/aviation/comments/b11251/airbus_a321_flying_jetblue_claims_we_reached/,13,2019-03-14 18:36:00,The display says we were cruising at 799mph but from what I can find it says the max speed is 540mph. What's going on? Thanks
26,Daytime landing at BGI with cloud cover on JetBlue,5,adjrs1,https://v.redd.it/zs4sp1rha1921,12,2019-01-07 20:14:22,
27,Why have I seen this JetBlue A321 at Paine Field so much?,23,3lw41v,http://i.imgur.com/s3x7kpJ.png,12,2015-09-22 07:11:04,
28,Where can I buy aircraft seats?,3,cichdv,https://www.reddit.com/r/aviation/comments/cichdv/where_can_i_buy_aircraft_seats/,12,2019-07-27 07:15:19,"I was thinking how it would be neat to buy an aircraft passenger seat just because it would be fun to sit in and a neat decoration. Where can I buy any aircraft seat, used or new? I am also curious of what airlines do with all those seats. If JetBlue is refurbishing all of their a320s with new seats and they have 130 a320s with 150 seats, that’s a whole lot of seats they have to get rid of. What happens to these seats and where do you think I can get one of these seats from any airline or company?

Thanks for reading this long post!
-Hen8"
29,Why JetBlue Airways Just Might Stick With Embraer,14,6a4ta9,https://www.fool.com/investing/2017/05/08/why-jetblue-airways-just-might-stick-with-embraer.aspx?yptr=yahoo&ref=yfp,12,2017-05-09 15:29:48,
30,Flight deck of a JetBlue E190.,82,5dz47h,https://i.reddituploads.com/6c7a86f0f547437dac204d2f2d2ecf69?fit=max&h=1536&w=1536&s=c4e26be99fb114b0593ebf057d433f2f,12,2016-11-20 20:44:16,
31,Where did airliners go to escape Sandy? Anyone got pics?,12,12b169,https://www.reddit.com/r/aviation/comments/12b169/where_did_airliners_go_to_escape_sandy_anyone_got/,12,2012-10-30 03:28:37,"Saw a photo earlier of a completely empty ramp at EWR. Made me wonder where the airlines flew their planes to.

So I'm assuming that the ramps at JFK, LGA, EWR, PHL, IAD, BWI, DCA, BDL, BOS and more are completely empty. That's got to be hundreds of planes. Where did they all go? Is there some ramp at ORD packed with United and American planes? Is CLT jammed up?

Anyone got pics?

EDIT 1: JetBlue took their planes to FLL. See photo in comments. Thanks /u/herbg22.



"
32,JetBlue ERJ-190 appears to be landing in hurricane — is this common?,54,cygsu3,https://i.redd.it/raerhzkva2k31.jpg,11,2019-09-02 02:51:36,
33,What's Your Favorite Airline Company?,1,9g52f7,https://www.reddit.com/r/aviation/comments/9g52f7/whats_your_favorite_airline_company/,11,2018-09-16 01:18:18,"In my opinion one of my favorite airlines is Norwegian as they are pretty good as an international budget airline. However, for non budget carrier I'd say JetBlue since it's cheap for me to fly for only $100 or less, and I'd say their product is better than united or AA. I like British AIrways a lot, but recently they switched to buy on board service within Europe instead of free food :( .Turkish Airlines  and Emirates are pretty good too."
34,Turbulence on Jetblue flight from Boston injures 24 passengers,18,4xdpu3,http://boston.cbslocal.com/2016/08/12/jetblue-turbulence-logan-airport-sacramento/?cid=facebook_WBZ_%7C_CBS_Boston,10,2016-08-12 18:13:06,
35,Boeing and JetBlue have backed an effort to create hybrid electric planes and economy will have less room,4,cdf1kl,https://i.redd.it/ztcrvrqhlfa31.jpg,10,2019-07-15 12:52:55,
36,JetBlue flight 29 landed safely in Nassau today after a front gear malfunction. https://t.co/QXZJzCjMao #B629,13,4byvxk,https://twitter.com/flightradar24/status/713500579692167168,9,2016-03-26 03:13:27,
37,JetBlue Captain Break Down (Facts),11,rl77a,http://www.fearoflanding.com/accidents/jetblue-captain-break-down/,9,2012-03-30 21:45:15,
38,jetBlue Retrojet spotted at JFK (sorry for potato quality).,125,7qbiqs,https://imgur.com/0FRVqkk,9,2018-01-14 15:07:00,
39,Stopping to refuel? A320 transcon - can anyone share some insight?,2,apavb0,https://www.reddit.com/r/aviation/comments/apavb0/stopping_to_refuel_a320_transcon_can_anyone_share/,9,2019-02-11 04:15:56,"Hey friends,

I had a very unusual experience last month flying Alaska Airlines, and my girlfriend had the same experience with JetBlue today.

So we were flying from BOS -> SJC on Alaska, on an A320-200 on a very very cold Sunday evening. We were told that we had a totally full flight and that due to the weight, cold temperatures, and high winds, we needed to stop in Detroit to refuel the plane. We ended up getting canceled, sleeping in the terminal, and taking a Delta flight back. Alaska compensated us nicely but still...this is a new one for me - I've flown many transcontinental trips over the last ten years and haven't had the unplanned stop experience. 

Just today, my girlfriend is flying back from JFK -> SJC on JetBlue, on an A320-200, and had a similar experience, she was told due to high winds. Her flight has to stop in PHX to refuel. 

I was under the impression that for the A320ceo, a transcontinental hop was well within its operating range of 3200 miles. I've never had this experience or heard of others having to stop to get fuel. 

Am I crazy?  Is this normal? Is this just due to weather and unusual high altitude winds? I think I'm well versed on airline/airplane topics but I am not in the industry. Can someone offer insight? 

Thanks"
40,why don't planes have official names? like the way all boats do from the dawn of time? or even all trucks in India have names ... why not aircrafts?,0,b2c9q9,https://www.reddit.com/r/aviation/comments/b2c9q9/why_dont_planes_have_official_names_like_the_way/,9,2019-03-18 04:43:22,"initially not sure what cause this is ...

&#x200B;

but right now - I think it has to do with commercial aspect - when you know you have been flying that Boeing 737 ""St Marry"" for last 12 years you would be concerned ... to book or not ...

the less the client knows .. the better ...

&#x200B;

few airlines do that Virgin, JetBlue for instance - now it can be clearly seen that some of their planes are 19+ years old :/ 

[https://www.planespotters.net/airline/JetBlue-Airways](https://www.planespotters.net/airline/JetBlue-Airways) 

when booking is there a way to know the name of a plane? to avoid some?> I""d rather fly on a 3 month old plane vs 19 year and 2 month old plane for SAME money "
41,JetBlue Pilot suffers eye injury from green laser during flight,23,wulhg,http://www.thefuturepost.com/travel/jetblue-pilot-suffers-eye-injury-from-green-laser-during-flight-155.html,9,2012-07-20 05:21:51,
42,JetBlue-Virgin America Merge??,15,4bo5zc,http://seekingalpha.com/article/3960570-jetblue-virgin-america-deal-ahead,9,2016-03-23 23:56:27,
43,"JetBlue and Boeing Just Bet Big on These Small Electric Jets: The hybrid-electric jets could replace gas-guzzlers on flights under 1,000 miles",26,63off0,http://www.cntraveler.com/story/jetblue-and-boeing-just-bet-big-in-these-small-electric-jets,9,2017-04-06 01:04:09,
44,"Facebook users complain about pilot's Sidney Crosby joke, JetBlue defends pilot.",17,1fqews,http://consumerist.com/2013/06/05/pittsburgh-penguins-fans-upset-after-jetblue-pilot-hears-crying-baby-asks-if-its-sidney-crosby/,9,2013-06-05 21:34:20,
45,JetBlue Gateway Select,2,991791,https://www.reddit.com/r/aviation/comments/991791/jetblue_gateway_select/,8,2018-08-21 11:43:25,"Hi everyone,
I’m writing this post to seek more information on this program since what I have found so far is  dated. 
I was initially invited to take the assessment test  on July 23rd, 2018. I took the test August 1st and I have not heard anything back since. I have emailed the program asking when I would be notified if I will be moved along into the program but I have not received a response yet. 
Phone interview invitations were supposed to be sent by August 9th with the actual phone interview taking place between July 30th - August 22nd. Since today is the 21st, I’m assuming no news is bad news. Has anyone else in the program heard anything?"
46,Criminal complaint against JetBlue pilot reveals the situation was even worse than reported,15,ri6bx,http://[Imgur](http://i.imgur.com/5tlbA.png),8,2012-03-29 01:28:47,
47,JetBlue Landing Gear Failure at LAX a few years back.,20,6218zw,https://www.youtube.com/watch?v=epKrA8KjYvg,8,2017-03-28 22:35:25,
48,"This is how jetBlue gets it's ""Blue""",22,1f6dfu,http://i.imgur.com/ZqwJs12.jpg,8,2013-05-28 06:56:47,
49,"3 hour JetBlue flight in air for almost 8 hours, but the holding pattern is the interesting part...",0,4hxaks,http://flightaware.com/live/flight/JBU569/history/20160504/1330Z/KBOS/KFLL,8,2016-05-05 03:32:50,
50,JetBlue Airways Embraer ERJ-190AR N304JB KBUF,126,aa8gc4,https://i.redd.it/3tg2xv199z621.jpg,8,2018-12-28 11:14:49,
51,JetBlue can’t land Embraer 190’s rip,0,8z5l5g,https://i.redd.it/zmdkwytjt6a11.jpg,7,2018-07-16 02:24:23,
52,We returned to the gate 5 minutes after taxiing at departure and a man was escorted off the plane by police officers. How can I find the ATC recordings of what happened?,5,1vacun,https://www.reddit.com/r/aviation/comments/1vacun/we_returned_to_the_gate_5_minutes_after_taxiing/,7,2014-01-15 20:27:58,"The flight was JetBlue 993 on 12/31, Boston to Denver. We boarded a little late, it was probably close to 8pm EST (2014/01/01 0100Z) or perhaps a little before. Ultimately the flight departed at 0134Z.

This is the flight:
http://www.flightstats.com/go/FlightStatus/flightStatusByFlight.do?airline=%28B6%29+JetBlue+Airways&flightNumber=993&departureDate=2013-12-31&x=36&y=8
http://www.flightstats.com/go/FlightStatus/flightStatusByFlightExtendedDetails.do?id=319999828&airlineCode=B6&flightNumber=993

I found the KBOS audio archives http://www.liveatc.net/search/?icao=kbos but I'm not sure if I should be listening to departure, ground, or tower.

Are there other places that this kind of incident might be reported? I've googled around a little and haven't found any news articles, so it couldn't be *too* interesting - but my curiosity is piqued.

P.S. if there's a better subreddit for this, please let me know."
53,All right. Flying back now. New plane new anxiety,0,bipwcg,https://www.reddit.com/r/aviation/comments/bipwcg/all_right_flying_back_now_new_plane_new_anxiety/,7,2019-04-29 18:08:58,First time flying on American. A 737 800. I don’t hear about them in the news a lot. But I’m still nervous. Used to jetblue and their airbus planes.
54,"JetBlue emergency landing: Engine 'exploded,' smoke billowed, passengers say",0,2guztv,http://touch.latimes.com/#section/-1/article/p2p-81418421/,7,2014-09-19 17:53:36,
55,Does anyone know JetBlue's call out times?,0,4fjens,https://www.reddit.com/r/aviation/comments/4fjens/does_anyone_know_jetblues_call_out_times/,7,2016-04-19 23:50:38,"My wife has been a corp f/a for 10 years and was interested in getting on a commercial airline.  She is thinking about applying at JetBlue, but we live in TPA but she thinks she would need to be based @MCO. Thanks~"
56,This view on JetBlue flight today was pretty sweet,15,cw8nsw,https://i.redd.it/mb13y3c8e1j31.jpg,7,2019-08-27 22:44:37,
57,Caught the new JetBlue livery coming into JFK today!,22,5vebm0,http://www.airliners.net/photo/JetBlue-Airways/Embraer-190AR-%28ERJ-190-100IGW%29/4235703/L?qsp=eJwtjDsOwkAMRO/imiaKRJEOcgAouIC1HsFKIbuyzWcV5e5YK7o3b0azUSqr4%2Bu3VkETGVjTgw5UWflpNG0k7DilhOqQWAxRWlE/twjvjM9cXqv/5UUFGl5gqZ/c43QIgF4703gML9nqwq0PnfNC%2B/4DbZ0tGA%3D%3D,7,2017-02-22 00:28:55,
58,JetBlue launches limited time service to deliver pizza from New York to Los Angeles,6,8gowru,https://www.jetblue.pizza/,7,2018-05-03 12:45:52,
59,JetBlue NYFD,21,3vm0d5,https://scontent.xx.fbcdn.net/hphotos-xap1/v/t1.0-9/s720x720/12308556_1650449745234648_452824363250756448_n.jpg?oh=208fe8c01f46f7b5b41ee072404428f3&oe=56D55F08,6,2015-12-06 04:47:42,
60,Girl blown over by jet blast at St. Maarten! (JetBlue A320),8,s03rf,http://www.liveleak.com/view?i=31b_1333901432,6,2012-04-09 05:52:17,
61,JetBlue Power Outlet,2,aumosg,https://www.reddit.com/r/aviation/comments/aumosg/jetblue_power_outlet/,6,2019-02-25 18:54:26,"I was on a jetBlue flight on an a321 yesterday, while the flight attendant was preparing the cabin for takeoff, I was asked to unplug my phone and she said I could plug it back in as soon as we took off. Some time after that still before takeoff, she got up from her seat walked to a specific seat and asked them to unplug their phone. So how did she know that someone was using the outlet and is it possible that using the outlet could affect the plane."
62,JetBlue A321,24,83hht3,https://i.redd.it/aykc4h45qzk01.jpg,6,2018-03-10 22:49:30,
63,Beautiful view from the cockpit of a JetBlue A321,177,bhhnr1,https://i.redd.it/ywg0zkcz1ju21.jpg,5,2019-04-26 07:24:34,
64,Fired United FA faces very different fate from former JetBlue FA after using emergency slides at the gate,9,4dsgea,https://www.reddit.com/r/aviation/comments/4dsgea/fired_united_fa_faces_very_different_fate_from/,6,2016-04-07 22:36:34,"Former United Flight Attendant Julia Price was fired following the incident the other day in Houston where she opened the right side door at the gate and slid down the slide. Apparently she faces no legal charges and does not have to give restitution to UAL. Story here:     

http://www.clickorlando.com/news/united-airlines-flight-attendant-opens-emergency-door-deploys-slide-after-plane-lands-at-bush-iah    

What I'm curious about is why she faces no charges, when JetBlue attendant Steven Slater did. He pled guilty to various charges and paid JetBlue $10,000. Story:    

http://www.nj.com/news/index.ssf/2010/10/ex-jetblue_flight_attendant_st.html    

Am I missing something here? Why is this case different? 
"
65,jetBlue's April Fool's joke to employees :(,15,31451e,http://i.imgur.com/wUkEogZ.jpg,6,2015-04-02 01:39:10,
66,"""Four hours in Hell.""  One passenger describes being on-board a JetBlue flight that suffered multiple hydraulic failures. ",7,vg27e,http://newyork.cbslocal.com/2012/06/20/passengers-describe-jetblue-flight-from-vegas-to-n-y-as-four-hours-of-hell/?hpt=us_bn7,5,2012-06-22 22:06:37,
67,Door failing to arm?,10,2z16dv,https://www.reddit.com/r/aviation/comments/2z16dv/door_failing_to_arm/,5,2015-03-14 20:45:53,"I'm currently sitting on JetBlue Flight 1558 SKBO>KFLL.
We're taxing over to another gate to meet some mechanics because the ""main cabin door fails to arm"".

How does that work? Is there something that initiates a seal that allows pressurization in the cabin? Not completely sure how it works."
68,JetBlue ERJ 175 landing at FLL,9,c6eq65,https://i.redd.it/257o761fh0731.jpg,5,2019-06-28 06:50:57,
69,JetBlue A320 RetroJet livery at LGB.,30,a7cx09,https://i.redd.it/muvq6ulsi2521.jpg,4,2018-12-18 20:05:13,
