,title,score,id,url,comms_num,created,body
73,Delta vs American,7,5279k9,https://www.reddit.com/r/flightattendants/comments/5279k9/delta_vs_american/,10,2016-09-11 09:50:51,"I am hoping to apply to Delta or American whenever they open applications for non LOD speakers & would be thrilled to be hired at either! However, I was wondering if there were any real pros & cons between the two? (Flight benefits, reserve, flexibility, commuting, etc -- just throwing those out, I've got nothing specific in mind.) Or any other reasons you prefer one opposed to the other?

Thanks guys!  "
74,Phone Interview for Delta!,4,85u2q5,https://www.reddit.com/r/flightattendants/comments/85u2q5/phone_interview_for_delta/,10,2018-03-20 20:29:47,"So I passed my Video interview. I was so anxious because I messed up the first question! I'm so happy now. people say the phone interview is really laid back. Is that true? Is it only about background checks?
Please and thank you!"
75,How can an FA wear earplugs?,7,939830,https://www.reddit.com/r/flightattendants/comments/939830/how_can_an_fa_wear_earplugs/,10,2018-07-31 03:30:25,"I'm working as an FA at Delta and I love it.  The only issue is the plane pressurization/depressurization and noise is messing up my ears!  As a child I had bad ear infections and I'm worried they may come back as a result of the job.  I'm also worried about hearing loss and I've already noticed it starting to happen.  We aren't technically allowed to wear earplugs, but does anyone know a way around this?  Will a doctors note suffice?  Can I get an accommodation?"
76,Anyone submitted VI for Delta on 09/04 or before and still haven't received Talent Assessment yet?,3,9kwbxp,https://www.reddit.com/r/flightattendants/comments/9kwbxp/anyone_submitted_vi_for_delta_on_0904_or_before/,9,2018-10-03 04:38:45,"Im going crazy over here because I see people who have applied after me receive their VIs and TAs. Im Non- LOD and I understand that timelines are random and shouldn't be compared but Im just wondering if there is anyone else who has submitted VI on or before 09/04, and still has yet to received Talent Assessment.."
77,American vs Delta,2,83yhz0,https://www.reddit.com/r/flightattendants/comments/83yhz0/american_vs_delta/,9,2018-03-13 00:59:45,"Can anyone add input as to which airline is better to work for?  I have a F2F with one and I just completed a video interview for the other, so if I'm lucky enough to have to make a choice, I'd love to have some input on which way to lean.
Is one more prestigious than the other?  Does one offer a more competitive longterm pay?  Which benefits are better?

Obviously I'm thankful just to be at the point I'm at and realistically I won't get CJOs from both, but I'm looking for any insight I can get.  😊"
78,Just got my TBNT letter from Delta and it took 9 days.,7,856ng1,https://www.reddit.com/r/flightattendants/comments/856ng1/just_got_my_tbnt_letter_from_delta_and_it_took_9/,9,2018-03-18 01:00:23,"Did my video interview and got the TBNT letter yesterday evening. It of course said I had an impressive resume but they would pursue other candidates. It was a huge hit but I know the video interview could have went better. I was clean shaved which I hadn't done in almost a year (my beard is always very short and very well maintained) so I felt self conscious and nervous because I didn't have my security blanket on me (beard), but I still have a video interview with AA on Tuesday and I have also a group interview with Skywest on Thursday. Still dreaming but a little hurt about Delta."
79,Delta Video Interview,6,9fbb5w,https://www.reddit.com/r/flightattendants/comments/9fbb5w/delta_video_interview/,9,2018-09-13 00:18:12,How long does it usually take to hear back about your video interview from Delta ?
80,"With AA, Delta and United, does Washington DC as a base get a lot of international flights?",2,9zer6o,https://www.reddit.com/r/flightattendants/comments/9zer6o/with_aa_delta_and_united_does_washington_dc_as_a/,8,2018-11-22 17:58:11,
81,Question for Delta applicants who made it to F2F this year,4,a0oirt,https://www.reddit.com/r/flightattendants/comments/a0oirt/question_for_delta_applicants_who_made_it_to_f2f/,9,2018-11-27 01:48:28,"I know they tell you to bring 2 forms of ID and they really recommend you bring a passport. I had a passport when I was 15 and I had no idea they expired after 5 years if you're under 16. I am going to my F2F very soon and I was wondering if there was anyone who went without a passport? I can get one easily but not before my F2F. PLEASE tell me this is okay and I'm not going to get kicked out of the interview day because I don't have a passport.. I was going to bring a birth certificate, social security card, expired passport and driver's license just in case. "
82,Haven’t heard back,1,ac01ky,https://www.reddit.com/r/flightattendants/comments/ac01ky/havent_heard_back/,9,2019-01-03 04:00:46,"Hey guys! So I applied to both United and delta and did my VI with United but haven’t heard anything back. Delta hasn’t contacted me at all, even to just confirm they received my resume. I’m curious how long it takes for them to contact people? I haven’t even received a TBNT and the suspense is killing me 😞 i just want this so bad "
83,Delta F2F interview,3,849wi9,https://www.reddit.com/r/flightattendants/comments/849wi9/delta_f2f_interview/,9,2018-03-14 06:22:17,"Hi guys! I have my face to face interview on THURSDAY! I am so so excited, but so extremely anxious at the same time. I’ve been studying and reading up on everything but I still just feel unprepared! Can anyone give me any tips about the day or any interview question tips? Anything is appreciated!! "
84,Delta,1,8cr1ir,https://www.reddit.com/r/flightattendants/comments/8cr1ir/delta/,9,2018-04-17 01:05:54,What’s the deal with hiring? I’ve been waiting for job openings to post for so long and nothing’s ever available 
85,We’ve got a situation...,6,83e7g5,https://www.reddit.com/r/flightattendants/comments/83e7g5/weve_got_a_situation/,9,2018-03-10 12:27:03,"PLEASE HELP!
I am a aspiring FA, I would love to work for American Airlines or Delta. I want to travel and see the world even if I have to do it alone... 

My main thing is, has any flight attendant been out in a situation they didn’t know how to handle? 

I’m extremely scared I might do the wrong thing, i.e...

One time I was on a Greyhound bus, sitting in the window seat, 2nd row, a little old lady sat next to me. The bus gets a little noisy, the wind hitting windows etc...  Next thing you know this guy is going up and down the aisle, he starts talking about forgetting his meds and he starts talking (I think his references were) war, battle and his buddies. I thought anxiety? PTSD? I didn’t know what to do, he was just standing by my aisle next to the little old lady. I want to ask him if he was okay, but he was calm, just whimpering and mumbling. I stay cool, he touches the ladies hair, I don’t know if accidentally or on purpose and she whimpers, he says sorry. I really wanted to escort him back to his seat but all I could think about was Greyhound doesn’t do security checks, he could have a weapon, what if my intervention triggers something? I wanted to ask the driver or the man in front of me for help, but I was afraid. Maybe I was going to trigger danger to people around me, especially the little old lady next to me. The PTSD  guy gets closer to this driver and door, not sure what he’s aiming for, the guy and woman in front freak out and grabs him. PTSD guy then freaks out, and says I don’t want to hurt you, man says I don’t want to hurt you either but you’re putting my life in danger, PTSD guy says I just want get off the bus. The lady that grabbed him calls the cops, and he’s safely escorted.

I’m upset because I did nothing, I bought the lady a water bottle at the pit stop to try and comfort her but I practically did nothing. 

My dream is to become a flight attendant, but what if something like that happens on a plane and I don’t know what to do? How to handle? I don’t want to become a flight attendant and have my actions harm someone when I’m supposed to keep them safe. HELP!"
86,Want to become a flight attendant. What companies should I apply to?,2,5m7qjz,https://www.reddit.com/r/flightattendants/comments/5m7qjz/want_to_become_a_flight_attendant_what_companies/,9,2017-01-05 20:34:13,"Hi! This kinda seems like a obvious and dumb question but I recently decided to seriously pursue my dream of becoming a flight attendant! I already applied to Delta. Gonna apply to American Airlines, Virgin, and United. Is there others that I'm missing? I live in the SF Bay Area btw. The only regional airline I can think of is Southwest and they're not hiring atm. Anyway, thanks!"
87,Do you feel the emotional assist animal program has been abused and what if anything could fix it?,8,7tqd5v,https://www.reddit.com/r/flightattendants/comments/7tqd5v/do_you_feel_the_emotional_assist_animal_program/,9,2018-01-29 09:11:33,"In light of recent incidents and the harder line Delta has chosen to take regarding animals traveling on board. Do the rest of you (flight attendants) feel this program has been almost laughably abused? There is certainly a need here for disabled passengers. Obviously seeing eye dogs get a pass and some others that are harder to spot. Dogs that can detect and warn of an oncoming seizure for example or maybe some that help with PTSD.

Unfortunately, I have seen far too many bringing large and clearly not emotionally supportive animals on the aircraft. Even dogs that are obviously show animals. I feel this puts an unnecessary strain on other passengers comfort in an environment that is already uncomfortable by nature. Those that choose to follow the rules, pay for their pet, get a carrier, keep the pet in the carrier for the duration of the flight, end up looking like chumps next to those that flagrantly abuse this system and save money doing it.

I think a couple things could be done to mitigate this issue.

1.) Make an emotional support animal have to be of a handful of select breeds. No more just getting a certificate for Fluffy. If you need a support animal it must be one of these choice few and possibly come from a select group of licensed breeders.

2.) Not my idea but a fellow FA mentioned requiring insurance for the animal to travel. That way if the animal were to attack the airlines responsibility would be waived and the victims recourse would be through the owner.

My ideas certainly aren't perfect so I'm interested in hearing others views and ideas on this topic. Maybe many of you aren't bothered by the influx of pets onboard and I stand in the minority.

Delta article:
https://www.nbcnews.com/business/travel/growls-are-growing-over-delta-s-new-rules-flying-service-n841376"
88,Just waiting to hear back from my live video interview; applied as a ready reserve ticketing agent to hedge my bets,1,ajpupm,https://www.reddit.com/r/flightattendants/comments/ajpupm/just_waiting_to_hear_back_from_my_live_video/,9,2019-01-25 18:02:48,"Good morning everyone!

So I finished my live video interview for Delta a couple weeks ago. Unsure how it went but I focused more of showing my genuine self to them instead of rehearsing my answers back to them (that was my down fall last time) and I tried to be shorter with my responses.

I applied as a ready reserve ticketing agent in my state (only thing available in my state that I’m qualified for) and it turns out it’s two hours away from my sisters house (somewhere I can stay rent free for the time being while I get situated if I end up moving up there). I figured if I can’t get in as a FA with Delta, I can at least get into the company and then reapply as a FA in 6 months. 

Any thoughts on this decision? Has anyone done this before?"
89,Talent assessment question for Delta,5,9rlfjt,https://www.reddit.com/r/flightattendants/comments/9rlfjt/talent_assessment_question_for_delta/,8,2018-10-26 18:55:47,"Hi, 

So I got the first email to do the 20 min assessment that you get after turning in your VI, but it's about a whole week and I haven't received the second email with the actual link to the assessment.. in the first email it said it could take up to 5 business days to receive it.. just curious to how long it took you all to receive your linked email? Thanks! "
90,Tips and Tricks to Get Through,30,99emol,https://www.reddit.com/r/flightattendants/comments/99emol/tips_and_tricks_to_get_through/,8,2018-08-22 20:08:49,"Everyone keeps wanting to know the same questions, so here is my summary as best as I can get. I have posted this before in and out of other comments, and hopefully this will narrow it down and help you. I applied to 4 regionals, got 3 interviews, (one I later declined), and got both offers from the ones I interviewed with. The one regional I didn't get was because I have more than 5 jobs in 5 years, and a non-visible tattoo. So, here is my thoughts to help you:

1. If you are serious about being an FA, it might take you a year or more to get through several applications before being hired. I strongly recommend you take any medical classes like 'First Aid' or 'Basic CPR' to add to your application. (both are generally one day classes and not expensive) Airlines seem to all screen for medical and fine dining backgrounds. I was an Emergency Medical Technician, and for whatever reason, it was on every application I did and helped me get through. Also, any high end waiter jobs are also VERY helpful as is bartending. Avoid having 'too many jobs' hurt me.  **** Before even applying, know the height requirements and tattoo policy. If you are too short or too tall or have a large visible tattoo you will immediately be cut. Don't even apply and go through the process as it's a waste of your time. **** Have a MATCHING passport and state ID. We had one applicant have a married name on her papers, but her maiden name on her passport and she was going to be cut. She could prove she applied for an updated passport and made it through barely. Make sure your stuff matches.

2. Have to do a video interview? Here is what you should know. Most video interviews are of you, answering a question in under a minute from your laptop or cell phone. Some you can do over and over until you get it right. I would actually set up a test ahead of time. Use your laptop camera and video yourself against a solid wall background. Wear a blazer and shirt, and make sure the audio is clean and clear. When doing your videos, avoid 'uh's and 'um's. Speak very slowly and also if you can, write down common phrases ahead of time and sprinkle them into your video interview. Things like 'I am a great candidate for your airline because I am on time, work efficiently, and am perfect at solving customer issues to retain customer loyalty."" Sprinkle educated phrases like this ahead to seem smart and confident. Anytime you can throw in '..helping you make an informed, intelligent decision about hiring me...' goes a long way. 

3. Going to your face to face? YAY! Here is what you should know. 

(A) If you are male, shave. No beards, hipster stuff, earrings, rings, tattoos, or anything that makes you who you are. Your goal is to look like a conservative bank teller. If you are a lady, dress conservative also, no wisps of hair in your face. use lots of spray and hair gel or product and tie your hair back in a bun. Hair should be off of the neck. I think if you have braids/dreads as long as it's tied back you should be ok. No black lipstick. No dangly earrings or anything like that. Google bank teller and that's what you want to look like. Dark blazers, dark pants. Conservative. Look the part. No hipster rings on your hands, or funky watches. One ring. One watch. Maybe a bracelet but I would avoid it. 

(B). Pick your favorite paragraph from your favorite book. Stand in front of a mirror. Try and smile and read it aloud. Read it very very slowly. You will be nervous when you do it, and so your brain will want to read fast, so read slow so it sounds normal when you do it. During the interview, you will be handed a safety paragraph you will be expected to read loudly. Smile, read it aloud slowly. You may be in front of a hundred people, so I hope you are confident in being in front of lots of people. I watched an applicant get up in front of a hundred people, freeze up and cry. Don't be that applicant.

(C) Customer turnaround. Know a well thought out story about a time when you turned around an angry customer into a happy one. Be able to smile as you are saying it, and get it to about a minute long. No 'um's or 'uh's. Speak slow, and with purpose. Pretend you are a stand up comedian in that you should be active, command attention, even talk with your hands if need be. If you stand up like a frozen nervous lump, you will get cut. I actually wrote mine out so I could practice ahead of time and could recite it reasonably well. 

(D) Interview. Mention in the interview how much fun it was to learn CPR and First Aid, and how fascinated you are in learning safety procedures aboard Aircraft. Try and slip it in there when they ask you why you feel you are a great candidate. It might help you get through it. Avoid cliche stuff like 'I'm great with people'. Instead say things like 'I am a master at creating dynamic solutions on the fly to help solve issues angry customers face'. They will look for steps to turn an angry customer, like 'Listen, empthathize, apologize, and propose a solution. (L.E.A.P.)

(E) RESEARCH your airline. I guarantee they will ask you 'What do you know about us?'. Go to the airline's website and know that they operate a fleet of 150 jets and fly to over 180 US Destinations plus Canada and the Caribbean. Know they have about 5,000 employees. Know they have 5 US Bases.

(F) If they ask you if you will relocate, ALWAYS say yes. 99.9% of the time you know the base you are hired for so you know where you have to move to. You can always decline later if you are about to start training and feel you don't want to relocate. 

4. Pay. Before you even apply, make sure you have two full months of money set aside as most training is not paid. Regional training is 4 weeks and up to two weeks for your 3-day initial operating experience. This means it can be two full months before getting a paycheck. Also, $18/flight hour is NOT $18/hr but rather about $9/hr. You don't do this for the money. Regional Airlines like Compass/Endeavor Air/SkyWest/PSA/CommutAir are domestic and fly from Canada to the Bahamas. Mainline such as Delta/American/United fly internationally and can pay as much as $28/flight hour, which is substantially more. Know the money and the facts before.

Anyways, this is my summary so far. I may edit it in the future, but I hope this helps all of you get through and join me in the air. Best of luck!"
91,How to book standby travel when multiple routes are available?,3,5h0g9a,https://www.reddit.com/r/flightattendants/comments/5h0g9a/how_to_book_standby_travel_when_multiple_routes/,8,2016-12-07 18:23:46,"I'm trying to travel from Raleigh, NC to Medford, OR in about 10 days.  I've searched through the non-rev flight availability for Delta, and have found several possible routes that will get me there - RDU->SLC->MFR, and RDU->ATL->SLC->MFR, RDU->DTW->SLC->MFR, etc.  

My FA wife has never booked standby travel where there were multiple route options, so she's unsure what the best way is to book these flights.  Should I book just one of the possibilities, and ""wing it"" if I'm bumped?  Or should I book on all of the possibilities, and simply be a ""no show"" for whatever flights I don't use?  Should I book loots of ""single hop"" flights, covering all of the flights that I might want to take?  What method will maximize my change of getting where I want to go, with minimal hassle in terms of checking in and getting boarding passes?"
92,Complete VI for Delta on 9/24,2,9j41ff,https://www.reddit.com/r/flightattendants/comments/9j41ff/complete_vi_for_delta_on_924/,8,2018-09-26 20:25:19,"I completed my VI for Delta on 9/24, it was for LOD Spanish , how long after did you hear back from
Them for the next step?

Everything moved so quickly and now nothing.... I know it’s only been two days but I’m getting antsy. "
93,Are you trying to apply at Delta as a Flight Attendant?,2,aaijow,https://www.reddit.com/r/flightattendants/comments/aaijow/are_you_trying_to_apply_at_delta_as_a_flight/,8,2018-12-29 08:43:03,"I’m curious to know what the experience has been like, and want to share some helpful insight that will probably save you some heartache. "
94,Do regional FAs get to choose which airline they fly under?,4,4xxpry,https://www.reddit.com/r/flightattendants/comments/4xxpry/do_regional_fas_get_to_choose_which_airline_they/,8,2016-08-16 08:25:14,"For example, do I get to choose that I want to fly with American Eagle if I fly with SkyWest or Delta Connection if I fly with Compass?"
95,Subject line on a CJO Delta email?,3,81ikj7,https://www.reddit.com/r/flightattendants/comments/81ikj7/subject_line_on_a_cjo_delta_email/,8,2018-03-03 00:35:53,"I know the TBNT subject line is “thank you for considering delta air lines” but what is the CJO subject line? 

My F2F is next week and I know I’ll be super  anxious every time I open my email if I don’t get a CJO the day of lol"
96,DL F2F: Nude Heels w Navy Pants Suit?,19,ass1ff,https://www.reddit.com/r/flightattendants/comments/ass1ff/dl_f2f_nude_heels_w_navy_pants_suit/,8,2019-02-20 21:49:20,Is Delta in the house?!! (; I’m interviewing Friday and have a killer pair of nude Michael Kors 3in pump. I love how amazing they grip and would love to wear them with my navy pants suit—wide leg w 2 button blazer and a classy sassy silk white button up. Should I go for the gold or play it safe and buy black pumps? Dressing for my life over here! Thnx in advance for help!!
97,Update: I have a video interview with Delta (LOD French)!,9,93ph9t,https://www.reddit.com/r/flightattendants/comments/93ph9t/update_i_have_a_video_interview_with_delta_lod/,8,2018-08-01 18:34:16,"Ahh! Delta just sent me an e-mail to do one of the automated video interviews. Has anyone done a bilingual video interview? I know Delta is one of the hardest FA training schools to get into, so I will appreciate whatever advice you have!"
98,Delta finally sent out their rejection letter to everyone. LONGEST wait EVER,10,8bwe7t,https://i.redd.it/hj4xfkpfolr01.jpg,6,2018-04-13 08:03:55,
99,Delta Pay,2,9zs9qb,https://www.reddit.com/r/flightattendants/comments/9zs9qb/delta_pay/,8,2018-11-24 00:28:51,I know this might not be the best thing to ask but I’m at a crossroads right now. I’m currently a regional FA and in the beginning I wanted to move on over to Delta or United. Then things changed and for the past year I’ve been planning on switching and becoming a pilot starting January. As I get closer and closer to my school start date I’m weighing the pros and cons and at first being a pilot had more pros and now being a flight attendant has more. The deciding factor is the pay scale. I know if I become a pilot I’ll make a lot more money but I want to know what could I top out at or even start at if I continue on and try to go to United or Delta as a flight attendant? Or maybe a website with an updated sheet of the scales. Thank you for your help. 
100,Applied to Delta,2,5fdey6,https://www.reddit.com/r/flightattendants/comments/5fdey6/applied_to_delta/,8,2016-11-28 21:50:26,I am wondering how long it can take to hear back as to if I will be able to move forward in the interview process.  It hasn't been that long but I am excited and wondering.  Any information would be awesome!
101,Delta non-bilingual position taken down,4,ap2zml,https://www.reddit.com/r/flightattendants/comments/ap2zml/delta_nonbilingual_position_taken_down/,8,2019-02-10 14:01:29,"I applied for this position half a year ago and I’m still *current, under review*, but the position was recently taken off of their website. Does this mean they’ve filled all vacancies and I should “withdraw” and wait to try again, or that they’re just not accepting new applications (and will work through *current, under review* candidates?"
102,Looking to compare union contracts!,7,cy09m7,https://www.reddit.com/r/flightattendants/comments/cy09m7/looking_to_compare_union_contracts/,8,2019-09-01 00:14:56,"I’m an Alaska FA, and recently saw Delta published a new pay scale. My contract is easily found online, updates and all, but I’m having difficulty finding most recent / amended / ratified AFA/APFA contracts for:
American Airlines
Southwest Airlines
United Airlines

Wondering if they are not public, or if anyone could help me out."
103,FA and psychiatric drugs,2,7xeptd,https://www.reddit.com/r/flightattendants/comments/7xeptd/fa_and_psychiatric_drugs/,8,2018-02-14 05:11:47,"Good evening, y'all. I'm in the process of interviewing with Delta and had a question about prescribed medication.

I am generally healthy, but I battle a nasty sleep disorder spurred by adult ADHD. I have worked previously in a very difficult, stressful job on my medication. I am prescribed an antipsychotic off-label to help with my sleep for two years now.

I have looked at the DOT test, and saw that my medication is not tested for. I am worried about it setting off false positives during the drug test. I do not do drugs otherwise.

Any advice? "
104,Delta is Hiring Again,17,6yfa93,https://www.reddit.com/r/flightattendants/comments/6yfa93/delta_is_hiring_again/,8,2017-09-06 16:22:18,"http://www.deltajobs.net/flight_attendants.htm

Expected to remain open for two weeks."
