,title,score,id,url,comms_num,created,body
137,When will Delta's FA application close?,2,9ugc14,https://www.reddit.com/r/flightattendants/comments/9ugc14/when_will_deltas_fa_application_close/,6,2018-11-05 21:50:56,"I am asking because I only recently started working with a regional and I want to acquire at least a few months of experience before switching to mainline. Obviously, I'd rather not wait until next September to apply and would like to apply before the applications close to give myself more time for flying experience. "
138,Delta FAs,1,9ikd92,https://www.reddit.com/r/flightattendants/comments/9ikd92/delta_fas/,6,2018-09-24 22:15:52,They say Delta is in the works of voting for a Union this year and that they've received more signatures than they have ever had. How possible do you think it is that they will actually come to an agreement and vote for a Union? And how soon do you think it will happen if possible?
139,What was your cover letter? Could you please share with us the cover letters that worked?,5,auyxe6,https://www.reddit.com/r/flightattendants/comments/auyxe6/what_was_your_cover_letter_could_you_please_share/,5,2019-02-26 15:30:10,"I’ve researched this career path for months, and am now starting to actually apply. I wrote a first draft of my cover letter and have looked at samples, but I would love to see the real ones that actually worked. Doesn’t matter which airline, though I am a U.S. citizen so those are the ones I’d be applying to. Delta is my dream, of course. :) Thanks!

(Please be sure to remove your personal info if you post the full doc rather than just text!)"
140,How often do you deal with vomit?,11,800i63,https://www.reddit.com/r/flightattendants/comments/800i63/how_often_do_you_deal_with_vomit/,6,2018-02-25 02:33:56,"Aspiring FA here midway through the interview process with Delta, and my only qualm with this job is that I have a rough time dealing with body fluids, particularly vomit. Even just the idea of someone handing me a bag afee they got sick kind of freaks me out, although I'm sure I could train myself to handle it. 

How often do you have to deal with human vomit in your job? Have you become used to it? "
141,I’m (22f) very interested in becoming a flight attendant. Don’t know where to start?,5,assqe8,https://www.reddit.com/r/flightattendants/comments/assqe8/im_22f_very_interested_in_becoming_a_flight/,6,2019-02-20 22:44:53,"I’m (22f) very interested in becoming a flight attendant, but have no idea where to start. I’m about to get my high school diploma through an organization In May, but I have no experience in anything other than being veterinary technician, nor do I know any other languages. I do have a few tattoos but I’ve been told I could cover them up with clothing or tattoo coverup. I guess I’m considering Delta since Im from Birmingham Alabama.  I just want to know where I should start. Any help would be appreciated!!"
142,AA F2F,5,9t5v5u,https://www.reddit.com/r/flightattendants/comments/9t5v5u/aa_f2f/,6,2018-11-01 07:07:52,"I will be going to F2F in December. Anyone have any stories on how their F2F went? What to expect, tips or any advice? Does one person interview you during F2F or is it 1+ ? If they dont give CJO same day, are they known or have they called back to give CJOs at a later time? Do you know when the first classes of training begin? Do they normally express at the F2F which bases they are hiring for? Is there any reason why if given a CJO to either Delta or AA, you would chose Delta over AA and why? Any current AA FAs want to share any pros and cons about the company is greatly appreciated as well. Thanks!"
143,Career Change - Suggestions for Getting Started,3,ad89ch,https://www.reddit.com/r/flightattendants/comments/ad89ch/career_change_suggestions_for_getting_started/,6,2019-01-06 21:35:07,"I am 28 years old and have completed my Bachelors and PhD degrees in health science fields. I have 9-10 years of work experience with the last 3 being in real estate sales. I would like to pursue a job with a major carrier, but wanted to know if anyone has suggestions for maximizing my chances and/or things to work on prior to applying? I live in a smallish town in Florida, with generally close proximity to Jacksonville, Fl and Orlando, Fl airports. My small town has an airport with United and Delta flights. I am wondering how I would practically make this work in terms of commuting, where I would be based, and how I should go about selecting a company to apply to."
144,Flight Training and Base Placement,3,9kkc53,https://www.reddit.com/r/flightattendants/comments/9kkc53/flight_training_and_base_placement/,6,2018-10-02 01:03:36,"I have a applied for a position with Delta as a flight attendant and I am based in Atlanta. I know the training will be held here in my home city. Are the training days M-F or everyday and what is the schedule like during that time? 

I also wanted to know how likely is it that I would get based in my home city?"
145,Any Delta Fa's out there who have prior fa experience?,1,50e0yn,https://www.reddit.com/r/flightattendants/comments/50e0yn/any_delta_fas_out_there_who_have_prior_fa/,6,2016-08-31 03:08:22,"It's my dream to work for Delta, however I start training for skywest in 2017. I always thought having experience would help me land a mainline fa position... or does mainline prefer candidates without experience?"
146,Which airline has the best representation (union) for their FAs?,5,6vc9ds,https://www.reddit.com/r/flightattendants/comments/6vc9ds/which_airline_has_the_best_representation_union/,6,2017-08-22 20:41:51,"I believe Southwest is twu, and I know delta doesn't have one. I'm curious as to what unions have worked the best with their FAs to match their needs     

Sorry if this is written poorly, I wanted to post this before the thought slipped my mind "
147,Commuting from other countries,3,7h4ri1,https://www.reddit.com/r/flightattendants/comments/7h4ri1/commuting_from_other_countries/,5,2017-12-02 22:42:16,"So I’m currently a regional FA and I know with my type of pay it’s not affordable right now but I do intend to cross over to a bigger airline like Alaska or Delta but that doesn’t mean I have to wait till then to wonder what it’s like? I’m looking to move away from the states and commute once I get myself settled. Are there any blogs, YouTube channels, instagrams or any FA’s in this community that commute from other countries? I’m really wanting to live in the big cities(London, Barcelona, Venice, etc.) which I know can be expensive. Or maybe not even move to settle but move to explore and live cheaply. But I just really wanna hear from other experienced FA’s doing this."
148,How often does Delta reschedule flights compared to United?,2,57vhgt,https://www.reddit.com/r/flightattendants/comments/57vhgt/how_often_does_delta_reschedule_flights_compared/,6,2016-10-17 08:06:37,"Here's the deal:  Got a flight coming up in a few months that I booked on Delta.  They've already rescheduled the flight twice, moving it earlier and earlier.

United has flight to the same destination at a more reasonable time.

I realize that I can get a full refund from Delta and simply buy the United ticket, but I don't want to go through the trouble if United is just as likely to reschedule the flight, as well.

EDIT:  Clarified the time frame."
149,Anyone hired by delta!,2,8bzis2,https://www.reddit.com/r/flightattendants/comments/8bzis2/anyone_hired_by_delta/,5,2018-04-13 18:21:31,"Could you go into detail on what you wore for interviews? Makeup, hair, clothes and shoes? I’ve read to not stand out but I also clip my hair back with braids, is that too much?"
150,"Planning on applying in a few months once I turn 21, can I ask you guys some questions?",3,2jwlxs,https://www.reddit.com/r/flightattendants/comments/2jwlxs/planning_on_applying_in_a_few_months_once_i_turn/,5,2014-10-21 21:20:20,"Some of these might seem silly and I'm sorry if you guys see these posts often, but I want to be as prepared as possible if I can get an interview. Also I kind of want to feel out my chances. I'm planning on applying to Delta, Southwest, United, and American.

* When I apply should I apply before I turn 21, like a week or two prior, or as soon as I turn? I want to get in my application as soon as possible, but I don't want to have it tossed just because it's a few weeks before I'm 21.

* I started in on a French course earlier this year at a community college and I'm hoping this ups my chances a little, but how far along should I be before putting myself down as bilingual?

* Should I invest in a skirt suit if I get an interview and if so how simple/dressy should it be?

* I have a flight attendant for Southwest who is willing to recommend me, but I don't have any job experience to but down outside of a restaurant I worked at for about a year. This is due to a mixture of bad job market, a cushy few years of high school babysitting from people who paid me more than they needed to, a lot of focus on college courses, and some stupid decisions. I'm still trying to get work at some new retail stores opening up around my area, but how badly will this affect me?

* I weigh 130 lbs, but I wouldn't consider myself particularly in shape. Should I start exercising more in preparation? (Also cardio, core, or arms and legs?)

* Any advice on what to expect in questions if I get the interview or other helpful tips for things I couldn't think of are also very much appreciated."
151,"Curious about Delta, how many attempts when applying if hired?",2,33dfqb,https://www.reddit.com/r/flightattendants/comments/33dfqb/curious_about_delta_how_many_attempts_when/,5,2015-04-21 21:02:31,"I want to know about Delta specifically because I applied and went through the first interviews once, but other airlines and how many times you had to apply would be great too!"
152,Delta flight attendant job application,2,a213ag,https://www.reddit.com/r/flightattendants/comments/a213ag/delta_flight_attendant_job_application/,5,2018-12-01 10:29:03,"So on 11/29 I received an email from delta saying ""Congratulations! You have been selected to complete the next step in Delta's Flight Attendant hiring process a recorded video interview.""  

the email explained that I will receive the video interview link to do it. however I never received anything from them yet! 

I am really scared that they changed their mind. should I email them or this is normal. god help!  
"
153,A couple questions for you seasoned FAs regarding head and facial hair as a guy trying to join the ranks.,3,321p8k,https://www.reddit.com/r/flightattendants/comments/321p8k/a_couple_questions_for_you_seasoned_fas_regarding/,5,2015-04-10 01:35:01,"I've applied to Delta, United, and Southwest and am prepared to do whatever is necessary with my hair to secure a job.  At this time I have medium-long hair and a full beard, i actually look pretty similar to Kit Harrington (Jon Snow).

I gather that a professional haircut and clean shave is probably the way to go, though I'd like to know if there are any stories out there of male FAs with long hair because well.. I love my long hair and think I look generally better with a well kept beard!

"
154,Are unions really important in this industry? Why/Why not?,7,cx2nh2,https://www.reddit.com/r/flightattendants/comments/cx2nh2/are_unions_really_important_in_this_industry/,5,2019-08-29 19:44:59,I guess I'm just trying to understand if unions are beneficial or not in the industry. I've only applied to mainlines that have unions... But I'm starting to wonder about Delta and how their whole non-union system works and the pros and cons of having one vs. not having one.
155,Locked out of Delta account,1,aabhzi,https://www.reddit.com/r/flightattendants/comments/aabhzi/locked_out_of_delta_account/,5,2018-12-28 19:01:00,I locked myself out of my delta portal account— anyone done this? How do I fix it?
156,Question about AA and a tattoo.,2,6od77m,https://www.reddit.com/r/flightattendants/comments/6od77m/question_about_aa_and_a_tattoo/,5,2017-07-20 05:52:51,"I read a few posts back but couldn't really find an answer. I have a tattoo on the back of my neck, 2-3""s, nothing bad. Would this DQ me from American Airlines? I could technically cover it with my hair, collar or scarf? I applied and just realized this might be a problem.

What about with Delta?

Thanks !!"
157,Just applied for delta again... I have some questions,7,2l3c7v,https://www.reddit.com/r/flightattendants/comments/2l3c7v/just_applied_for_delta_again_i_have_some_questions/,5,2014-11-02 23:26:53,"I just submitted my application for the FA position for the second time. Last year I was fortunate enough to make it to the final face-to-face interview. I know where I went wrong last year; however, I'm wondering if my previous interview will have an impact on my new application. I should also note that I've been referred both times by a FA at the company. My dad is a captain on the A320. Also,  I've had some new leadership/job experience to add to my resume.   Any advice is welcome!!! "
158,Got TBNT from Delta... advice for future!,7,a7h8r2,https://www.reddit.com/r/flightattendants/comments/a7h8r2/got_tbnt_from_delta_advice_for_future/,5,2018-12-19 03:44:30,"Hi y’all! I’ve thought about being a FA for a long time now and got all the way to the live interview for Delta and got the TBNT. I heard some stuff on a Facebook group that they’re hiring a lot of LODs (but maybe that’s not even true) I’m okay about it because of the state of my life right now so, to me, no big deal since I can always reapply. 

I’m curious to see what exactly airlines (especially Delta since that’s the dream) are looking for from current FAs! I have years of customer service experience (restaurants, doctor’s offices, theme parks, and now I’m working at a bank) and I did musical theatre professionally throughout. I had no idea this field was so competitive when applying at first so, any tips or tricks or life lessons you would like to share, please do. :) 

P.s. This subreddit has been the MOST helpful so thank you! "
159,"An all-women Delta crew flew 120 girls between the ages of 12-18 to NASA headquarters in Houston to inspire female aviators, and to draw attention to the need to close the gender gap in aviation and promote STEM careers.",148,dg9z8a,https://i.redd.it/kg9mckcvvsr31.jpg,5,2019-10-11 08:31:10,
160,Why does the US have an 21+ age requirement? (Delta in specific),4,41lll8,https://www.reddit.com/r/flightattendants/comments/41lll8/why_does_the_us_have_an_21_age_requirement_delta/,5,2016-01-19 02:07:13,"I'm looking for a job as attendant, I speak and write German, Dutch and English. Delta is looking for bi-lingual attendants that speak Dutch/German so I thought I'd have a go at it.  
  
In Europe the age is 18+, why is it 21+ in the US?"
161,Invited to a Delta digital interview and a United on demand interview,8,9l56rq,https://www.reddit.com/r/flightattendants/comments/9l56rq/invited_to_a_delta_digital_interview_and_a_united/,5,2018-10-04 00:46:32,"Help! What should I expect? I’m pretty nervous but also very excited for the opportunity. 
Would appreciate feedback from others about their experience. Thanks in advance!"
162,What are some airlines I should consider applying for?,2,30gghi,https://www.reddit.com/r/flightattendants/comments/30gghi/what_are_some_airlines_i_should_consider_applying/,5,2015-03-27 07:57:46,"Although I am a student teacher, I am more interested in leaving school in order to pursue my dream of being a flight attendant.  Although I applied for United and Delta Airlines, I was rejected by both within a day of submitting my application.  

My job experience includes 9 months working at Build-A-Bear, countless hours of student teaching and classroom observations, and a stint in the Peace Corps which was cut short due to the Ebola epidemic.  

I am thinking of applying for a smaller regional airline in order to gain experience and network before reapplying for the bigger companies.  What are some companies I should consider applying for and which should I stay away from?

So far, I have applied to SkyWest, Virgin America, and Mesa Airlines; haven't heard back from Virgin, but I plan on attending a SkyWest interview, and I decided not to pursue Mesa because I have heard a lot of horrible stories about them.  What others should I consider?"
163,Delta F2F I have confirmation that there are absolutely no STAR questions or methods being asked or used at this years F2F!!,8,9vwlgp,https://www.reddit.com/r/flightattendants/comments/9vwlgp/delta_f2f_i_have_confirmation_that_there_are/,5,2018-11-10 21:28:19,"Woooh hoooo babyyy, STAR is the number one thing that I am not confident on!!! Good to know that it does not have to be used, as I feel like it makes you become very programmed and robot-like. I will answer my questions as honest as I can and let that personality shine through!"
164,How long to hear back after f2f with delta?,0,3kltzf,https://www.reddit.com/r/flightattendants/comments/3kltzf/how_long_to_hear_back_after_f2f_with_delta/,5,2015-09-12 03:30:35,I had my f2f the other day and my name wasn't called . I'm hoping I still have a chance but am ready for the tbnt just wondering if so when.
165,United/Delta/AA???? Applying for FA position from New Jersey,0,7kokdz,https://www.reddit.com/r/flightattendants/comments/7kokdz/uniteddeltaaa_applying_for_fa_position_from_new/,5,2017-12-19 01:02:46,"I have applied for AA/DL and UA and got F2F for the three. I guess, it's my previous FA experience (10 years ago for about 5 years) and ability to speak several more languages. 

With all three airlines I declared French, Dutch and Russian. My question is whether I should pick one of them to be able to fly international trips and if so - which one to chose (French or Dutch)? I live in NJ and UA from EWR is my natural choice as commuting to JFK from NJ is a nightmare. But is there any insight on whether it's more beneficial? 

And how does first year look like with a foreign-language speakers at UA and DL? They say DL has just several reserve days whilst at UA one's on a year-long one.

Any piece of advice is greatly appreciated!"
166,Where are new hires for delta usually based?,11,b8ht14,https://www.reddit.com/r/flightattendants/comments/b8ht14/where_are_new_hires_for_delta_usually_based/,5,2019-04-02 15:08:50,Hello! I have a F2F interview tomorrow in Atlanta with Delta. I was wondering what are my odds of being based there. Thank you.
167,"""The waiting is the hardest part."" -Tom Petty",13,76qvq9,https://www.reddit.com/r/flightattendants/comments/76qvq9/the_waiting_is_the_hardest_part_tom_petty/,5,2017-10-16 18:37:42,"I applied to Delta last week.  I figure there are 3 email possibilities.
1. We want a video interview
2. Still working on it, be patient
3. No thanks.

I've gotten letter two, which means I haven't gotten letter three, which is good and better than getting letter 3.

I've learned my airport codes, phonetic alphabet and am now working on their specific plane configurations.  I'm also practicing my answers for the video interview.  I know there is no possible way for me to learn everything before ground school, but if there is anything I can do to make it happen I will.

I've been thinking a lot about the application process in relation to my previous jobs.  In retrospect, most of my former jobs have aided me in some way.  All of them were heavy customer service, I've done fine dining, worked in close quarters, had to be mindful of very strict government regulations, handle a crisis (although not nearly as severe as possible with an aircraft),  speak to large groups, read different personality types and adjust myself accordingly.  I always have extremely loyal customers and have always been praised for my relations with customers.

Did I mention I'm OCD about knowing everything I can about what I'm doing?

Now, if only Delta would give me a chance to show them!  Keep your fingers crossed for me please!"
168,"I've recently decided I would like to become a flight attendant as soon as I can. Any suggestions on how to ""land"" the job?",3,25c7ad,https://www.reddit.com/r/flightattendants/comments/25c7ad/ive_recently_decided_i_would_like_to_become_a/,5,2014-05-12 09:43:36,"I've been looking for a customer service job that would allow me to travel...as much as possible. Becoming flight attendant seems to be the best way to make that happen. I have two people who are willing to give me referrals for Delta. I would like to be based in Salt Lake City if at all possible. Any insight on where to apply, when to apply, and what to expect?"
169,Paid Training,4,7sb9vo,https://www.reddit.com/r/flightattendants/comments/7sb9vo/paid_training/,5,2018-01-23 05:42:06,"Which airlines offer paid training for Flight Attendants? I know Delta does, but who else? "
170,video interview with delta airlines,4,77hsz3,https://www.reddit.com/r/flightattendants/comments/77hsz3/video_interview_with_delta_airlines/,5,2017-10-20 02:12:29,"good evening,

If you can't tell this is my first post to the subreddit. I applied for a flight attendant position for Delta and they replied asking for a video interview which is great. I was hoping to pick the brains of some of the attendants here and guys enjoy and not so much enjoy about the job. It seems like a rather awesome opportunity but I like to be educated before I take on jobs.  

thank you very much in advance!"
171,Hi I have two interviews coming up!,1,a1u106,https://www.reddit.com/r/flightattendants/comments/a1u106/hi_i_have_two_interviews_coming_up/,5,2018-11-30 19:40:06,"Hi everyone! Super excited/nervous because I have two interviews coming up. One interview with Skywest and another with Delta! I applied for two positions on a whim and am surprised by the quick response. Any interview pointers welcome!    


Also, How many days a week can I expect to be gone for work? (if i am hired) Might be a silly question but I'm obviously new. "
172,TBNT from Delta— What’s the email address?,1,9up82d,https://www.reddit.com/r/flightattendants/comments/9up82d/tbnt_from_delta_whats_the_email_address/,5,2018-11-06 18:25:14,"What’s phrasing for the TBNT’s that are sent from Delta? I’m trying to check my spam folder for anything from Delta (it’s been two months since I last heard anything) but searching for:

* Delta
* Talent
* Delta Recruit
* Application 
* Interview 

yields nothing. Is the phrasing literally “Thanks, but no thanks?”"
173,Attention Flight Attendants! I have some questions.....,3,b72r03,https://www.reddit.com/r/flightattendants/comments/b72r03/attention_flight_attendants_i_have_some_questions/,4,2019-03-30 01:09:43,"Hello all,

I'm just here to ask some questions regarding the position. My sibling is currently a Skywest Flight Attendant. They seem to love the position right now, I'm trying to convince them to make the move to working for a domestic airline like: United, Delta or American. Is there anything any advice you could give me in order to help me sway them to finally make the move? How's your experience with the airline you currently work for? Do you have a ""line"" yet or are you still on reserve? If you're on reserve, are you getting past your monthly minimum or no? My sibling currently does not hold a ""line"" at the moment, so that's why I'm trying to convince them to make the move now before they get used to living a life with a line. Thanks for the helpful tips and advice that you send me! "
174,Delta Turnaround,5,5la44f,https://www.reddit.com/r/flightattendants/comments/5la44f/delta_turnaround/,5,2016-12-31 18:32:52,"I recently completed a video interview with Delta Airlines and am waiting for a response, but I just got a CJO from Republic Airways. I REALLY want Delta, but also want to start flying. Anyone recently hired that has a time for how long it took them to get back to you?"
175,Bidding and Reserve? Specifically for Delta.,4,9dbikj,https://www.reddit.com/r/flightattendants/comments/9dbikj/bidding_and_reserve_specifically_for_delta/,5,2018-09-06 02:02:26,"Hi,

I'm having a hard time finding in depth info online about how Delta (or Delta style) reserve and bidding work. Can someone please explain both these things to me in depth, and how one bids for their reserve days/schedules? Ideally, if I become and FA I'd like to bid to work the first half of the month and have the other off. I know this will be a little harder at first, but I want to work the system to my benefit as soon as I get in, as much as I can. Especially since I'll be commuting.

&#x200B;

Any insight is appreciated, thank you! "
176,Advice for Delta video interview?,4,2oklz6,https://www.reddit.com/r/flightattendants/comments/2oklz6/advice_for_delta_video_interview/,5,2014-12-07 22:20:04,"I have to record a video interview for Delta in the next couple days, which is my first with them. I have a background in customer service, headhunting and sales; so I'm not super concerned but wonder if there's anything in particular I should be prepared for. 

Anyone have any specific advice or resources to point me to?

I really appreciate it!"
