,title,score,id,url,comms_num,created,body
0,Question for my Delta FA’s,7,d2bads,https://www.reddit.com/r/flightattendants/comments/d2bads/question_for_my_delta_fas/,35,2019-09-10 21:45:33,"Hello! I am currently a regional FA trying to move on to mainline. I applied with delta and completed my video interview, however I have not heard anything for over a week now. I have seen other applicants who have advanced to the LI while I’m being ghosted by recruiting lol. Just wondering if anyone else has been in this boat before and how it worked for you! TIA

Feel free to inbox me if you’d like."
1,Delta FA Tattoo Policy,2,9q40zy,https://www.reddit.com/r/flightattendants/comments/9q40zy/delta_fa_tattoo_policy/,32,2018-10-21 18:45:15,"Hey guys! Just posting out of pure curiosity. I’ve been invited to move onto the video interview, and as I’m preparing for the next steps, I’m curious as to how to handle the whole tattoo situation. I am a woman, and I have a half sleeve. There are obviously multiple uniform options that would cover this up no problem, but I’m curious as to whether I should tell them or just completely hide it with long sleeves/makeup moving forward? Everything I’ve seen online says a little bit of both. Advice? "
2,Sooo I'm running out of airlines,6,60birs,https://www.reddit.com/r/flightattendants/comments/60birs/sooo_im_running_out_of_airlines/,29,2017-03-19 22:24:38,"Hey guys so for the past 6-7 months I've been siting on flightattendantcareer and have been applying applying applying to airlines to be a flight attendant and I'm running out of airlines to apply for. What airlines do you recommend? Or what airlines do you recommend as a good airline to get my feet wet, or at least in the air? Not some super strict I'll lose my job airline. These are the airlines I've applied to:
United- had a f2f 6 months ago, so my time is coming back around
Frontier-rejected
Republic-VI (didn't do)
Virgin America- VI rejected
Delta- VI Archived.. Whatever that means
American Airlines- rejected
Skywest- couldn't make the hiring fair
Horizon- f2f rejected
Alaska- f2f rejected (but told me they'd recommend me to Horizon.. not sure if they meant recommend to apply or recommend me to the hiring team)

Edit: I currently work at a bank and have a wrist tattoo so I understand professionalism but not sure if that plays a factor in deciding airlines.
 
Also I've heard Omni and Envoy are good airlines"
3,Delta will open hiring Aug 13,27,96azwx,http://www.deltajobs.net/career_destinations.htm,29,2018-08-11 01:24:07,
4,Delta F2F Invitation!!,9,9vfkk3,https://www.reddit.com/r/flightattendants/comments/9vfkk3/delta_f2f_invitation/,26,2018-11-09 03:19:54,"Hello everyone! 

I just got my invitation for a F2F and I was trying to decide what time to pic it for.. my question to you all, is do you get flown in for your interview the day before or the day of? It's not a huge concern of mine because I'm fine either way I'm just trying to figure out what time would work best for me! thank you!! "
5,Delta Video Interview complete!,7,9bwo6x,https://www.reddit.com/r/flightattendants/comments/9bwo6x/delta_video_interview_complete/,29,2018-08-31 23:33:35,Phew! What a relief! What ever happens I'm glad I got the opportunity to learn from this application process!
6,"Delta Tried To 'Trap' Its Own Flight Attendants On A Plane, Messages Show",39,bvt4q5,https://m.huffpost.com/us/entry/us_5cf28bd5e4b0a1997b6b198c/amp,24,2019-06-02 07:15:17,
7,Delta asked me not to complete the video interview?,7,9lgqlk,https://www.reddit.com/r/flightattendants/comments/9lgqlk/delta_asked_me_not_to_complete_the_video_interview/,23,2018-10-05 02:45:40,"So yesterday I got an email from Delta congratulating me on moving forward in the hiring process and asked me to do a video interview. Then I just got an email from them saying to not do the interview.

>Hello,
You recently applied to requisition # 272525 for the position of Delta Flight Attendants (English Only). In error, you may have received a notification informing you of the next step in hiring process a recorded video interview in Hirevue, when in fact we are still evaluating your application and not ready to move you forward at this time. 

>We appreciate your interest in this position and want to ensure that the information provided is accurate. Please accept our sincerest apologies for the miscommunication

I don't see why they would tell me to do the interview then take it back?"
8,First Year Flight Attendant Salary,8,9ecvth,https://www.reddit.com/r/flightattendants/comments/9ecvth/first_year_flight_attendant_salary/,22,2018-09-09 17:16:48,"Hi everyone, 

I am currently applying to Delta and American. I currently work a corporate job that pays well ($65k), but i feel unfulfilled, and have wanted to become a FA for a while now.

Ive been doing the math, and to be able to afford my rent, car, bills, etc. I need to make $50k a year. Picking up extra trips, and possibly working a side job do you see this as a possibility as a first year FA? And if so, how do you recommend doing it?

Thank you! "
9,"I am a 25/F looking to pursue being a a flight attendant, thoughts?",14,9xdpju,https://www.reddit.com/r/flightattendants/comments/9xdpju/i_am_a_25f_looking_to_pursue_being_a_a_flight/,21,2018-11-15 21:16:43,"I have been working a recruiting job for a few years post college. I do like my job but i am bored. I feel i am wasting away behind a computer screen. I love meeting new people, I am good with people, and I love traveling. I am considered attractive, no family, and no commitments keeping me from pursuing a career as a flight attendant. I have a video interview with Delta tomorrow so I am doing my research on what it takes, the hours, benefits, pros and cons, etc.

&#x200B;

Young adults that are flight attendants, how do you like it and do you think the pros outweigh the cons?

What is a typical weekly schedule like for you?"
10,How do buddy passes work?,7,9nnb9p,https://www.reddit.com/r/flightattendants/comments/9nnb9p/how_do_buddy_passes_work/,25,2018-10-12 23:29:53,"I hear American Airlines gives out 16 buddy passes per employee. Yes 16! Mind blown, but unfortunately this isnt the same case for Delta. Seems like Im going to have to marry my boyfriend first in order for him to get a buddy pass smh. "
11,Relocation question,5,3a41di,https://www.reddit.com/r/flightattendants/comments/3a41di/relocation_question/,20,2015-06-17 05:40:54,My friend is considering trying out for a job as a FA with Delta. She lives about 30 minutes from O Hare currently. Were worried that should she get the job she'll be asked to move. How likely is this?
12,Didn’t even get an in person with United. I feel like such a failure.,9,9829vn,https://www.reddit.com/r/flightattendants/comments/9829vn/didnt_even_get_an_in_person_with_united_i_feel/,20,2018-08-17 17:30:28,I applied at Delta too. Watch me not even get a video interview.  I’m so pissed I can hardly see straight :( sorry I just need to vent. 
13,Did not get picked for the next stage of the Delta interviews.,5,a3w3l1,https://www.reddit.com/r/flightattendants/comments/a3w3l1/did_not_get_picked_for_the_next_stage_of_the/,25,2018-12-07 06:56:57,"I did my live interview last month, around the first week of November.  Unfortunately, I found out today that I was not selected for the f2f in Georgia.

As disappointing as it is, this is the farthest I’ve gotten with them so far.  So at least I have that."
14,International,2,58oylj,https://www.reddit.com/r/flightattendants/comments/58oylj/international/,19,2016-10-21 23:00:48,"Hello all. I was wondering what airlines fly international from the US? I'm really looking to apply to those types of airlines. I know Delta, American and Alaska as well as United do. I'm waiting on American and Alaska and was rejected by United but who else does?"
15,Seeking real FA feedback and not job application advice,31,ab3ouy,https://www.reddit.com/r/flightattendants/comments/ab3ouy/seeking_real_fa_feedback_and_not_job_application/,19,2018-12-31 07:30:14,"Okay sorry if this isn’t the place to post this? But i don’t know where else i would. Just asking a real question other than how to get past the delta video interview. I get that this job is great for some people... but i’ve been doing it for 8 months now and it honestly feels like the worst decision i have ever made in my entire life and i feel like the only flight attendant that feels this way?
I work for one of the two major american carriers and when you do the math... i get paid like $15 an hour. Living in nyc and paying rent at a place im only at like six days a month. I never sleep. I only eat plane food or airport food. I’ve lost all solid, constant relationships outside of the internet or seeing people for a few hours once every other month. Im alone all the freaking time. I don’t have a home. This job controls my life for less money than i made working a part time retail job. I try and read constantly because i feel like im going braindead just serving drinks and getting yelled at by middle aged men but im too tired to stay awake while reading. 
Am i crazy for hating it and feeling like it was a terrible decision that completely ruined my life? Does anyone else feel this way?"
16,Visual Tattoo checks,4,d3ylku,https://www.reddit.com/r/flightattendants/comments/d3ylku/visual_tattoo_checks/,18,2019-09-14 05:08:42,"Does anyone know if Delta, American or United do visual tattoo checks when you make it to training?"
17,Become a flight attendant with a misdemeanor,4,a5wkga,https://www.reddit.com/r/flightattendants/comments/a5wkga/become_a_flight_attendant_with_a_misdemeanor/,17,2018-12-13 22:11:11,"I have a conviction of contributing to the delinquency of a minor about three years ago and I have a interview coming up for delta, I was wondering if I'm automatically disqualified because of it? "
18,Delta bidding/swapping process?,1,9j3g3y,https://www.reddit.com/r/flightattendants/comments/9j3g3y/delta_biddingswapping_process/,15,2018-09-26 19:20:45,"Can someone explain the whole process of bidding for trips on Delta and then swapping them out? I understand that as a junior flight attendant, I won't have much chance of getting the trips I want at first, but I'm committed to learning the system as thoroughly as possible right away so that I have the best chances of getting the trips I want as soon as possible. Basically, I want flights that are as long as possible, with trips that are as long as possible being my second concern. After that, my preference would be international over domestic. I don't really care about weekends off. What are the other variables we can bid on?

Also, how do you trade/drop/pick up trips? I understand that there is a system called Open Time, but what is it like? How do I signal that I want to drop my A days, for instance? I know I won't be able to drop them at first when I have no seniority, but how do I even go about trying? Is there any harm to listing them as something I want to drop? I'm thinking if no one picks them up, I just work them, which I would have had to do anyway, right? Is there a downside to listing them as something someone else could pick up if they want?

Would anyone be willing to post screenshots of the systems Delta uses for bidding and swapping? With personal information blocked out, of course.

Thanks!!"
19,Applied to delta! Crossing my fingers!,10,2g1j48,https://www.reddit.com/r/flightattendants/comments/2g1j48/applied_to_delta_crossing_my_fingers/,17,2014-09-11 01:12:30,"Could anyone offer me advice as far as their interviewing goes? I would like to be prepared. It's been my dream to be a flight attendant since I was a little girl! I understand delta does phone interviews and then the person goes to Atlanta for the last interview.

Background on myself: 3 years LPN experience, speak polish fluently, A.S. Retail experience.... No tattoos or piercings.
"
20,"United/Delta FA applicant, drug test question (clean a month)",3,9xoe2h,https://www.reddit.com/r/flightattendants/comments/9xoe2h/uniteddelta_fa_applicant_drug_test_question_clean/,16,2018-11-16 20:46:22,"Hey all, 

A friend of mine went to Colorado for several days and used a lot of weed, but didn't continue to. One month later (yesterday) he did an at home test and still tested positive for THC. Today he recieved a request for the online video interview for flight attendant, and was wondering if he should still go ahead with it. At what point in the process do they test? Before a face to face interview? The day when you recieve a job offer? The first day of training? He is not planning to use again.

Also, once you do the internet video interview, how far out is your F2F interview scheduled? 

Thanks"
21,Salary,4,7v448q,https://www.reddit.com/r/flightattendants/comments/7v448q/salary/,16,2018-02-04 05:46:45,"I work for an airline but am trying to move to mainline
I have seen many diffferent salaries posted but wanted a rundown
According to what I see
Southwest pays most which I was surprised about
Delta and united:$30
American:$28
Jetblue $24
Regionals:18-22
British airways?
JetBlue should pay more
I want to know the actual starting salary
I really would like to be making atleast 25 an hour the work is hard the lifestyle is stressful and cost of living is high"
22,"United, American & Delta - reserve system, how does it work?",10,5kkpxx,https://www.reddit.com/r/flightattendants/comments/5kkpxx/united_american_delta_reserve_system_how_does_it/,16,2016-12-27 20:04:39,"I'm with SkyWest currently and trying to make the hard decision on whether to go to a major! 

Another question I have is what's the minimum hours you need to work to be full time? (Curious because I plan on having kids in the future but never want to give up my job. OO is 150 hrs every 3 months which seems doable while having a family)"
23,Delta face-to-face help!,4,2mc45l,https://www.reddit.com/r/flightattendants/comments/2mc45l/delta_facetoface_help/,16,2014-11-15 03:26:05,"[EDIT : I didn't realize there was a topic with the same name; however, my content is different.] 

I received an e-mail asking for my travel documentation, so I'm assuming that I'm probably moving forward... But I might be jumping to conclusions. I did the video interview a couple of nights ago. 

If I am moving forward, this will be my second time attending and I'm wondering what questions I should bring for the flight attendants performing the interview? Should I ask questions work experience, scenarios, job duties? What do you think? Also any kind of suggestions would be helpful on how to land the job. I know how to dress/behave, but where I failed last time was my lack of social interaction with the FAs and the other interviewees. Some of my responses to the F2F interview questions may have been ill prepared too (I got one on changing priorities on some project outside of work... I'm a planner and rarely have to do things like that... ugh!) 

Also, would it be a good idea to avoid conversations around my family that works for the airline? I'm assuming yes, but that's how I related to the airlines...

Thank you in advance! Any help an would be greatly appreciated! :)"
24,LETS TALK DELTA,7,7yw0ew,https://www.reddit.com/r/flightattendants/comments/7yw0ew/lets_talk_delta/,15,2018-02-20 16:51:51,"I applied a while back and was wondering what's going on with their application process!! Seems to be all over the place. Lastly, why are they still accepting applications?!?!?! Are they going for the world record or something????"
25,Interview attire,1,b7v8fm,https://www.reddit.com/r/flightattendants/comments/b7v8fm/interview_attire/,15,2019-04-01 04:56:05,"Hi
I have a f2f interview with Delta for CSA and is it ok to wear pants instead of a skirt?

Thanks in advance!😊"
26,What kind of questions should I expect to answer during the Delta Live Interview?,7,9w0ajm,https://www.reddit.com/r/flightattendants/comments/9w0ajm/what_kind_of_questions_should_i_expect_to_answer/,15,2018-11-11 05:33:34,"Any tips?  And what should I anticipate for?  This is the farthest I've gotten with Delta so far, and glassdoor only covered the questions that I answered during the video interview.

Thank you!

Edit- Thank you guys so much for your awesome and sound advice.  I checked out glassdoor again.  It looks like, according to recent interviewees, that it's five questions: four behavioral and one situational.  

Edit 11/12/18- I did the interview.  Can't say much due to confidentiality reasons.  Not as bad as I thought it would be.  "
27,Whats my next best opportunity?,4,chjpdb,https://www.reddit.com/r/flightattendants/comments/chjpdb/whats_my_next_best_opportunity/,15,2019-07-25 09:52:44,"Sooo my application for trainee flight attendant with American Airlines was rejected. Darn, but as it was my first attempt, I'm not totally heartbroken.  However my heart is really set on working with American Airlines as a flight attendant, and I totally plan on applying again when the next opportunity arises, but I need to look at my other options as well. What can I do in the meantime? 

&#x200B;

I'm definitely applying for other airlines and keeping an eye out for when Delta and United start hiring (for more than just a bilingual position). I have no experience as a flight attendant, and find myself wondering if I could get experience with another airline - would that make me more desirable as an applicant? Since Mesa airlines have a partnership with American and United is there a possibility of that being a good step in the door? 

&#x200B;

Or would it maybe be better to go another route by applying for a different Job with American? Getting my name and work ethic out there and known within the company, and so when there's later on a chance to apply for my desired job they know who I am, and I am doing so internally. I see that they have a Customer Assistance Representative position open, and as I have several years of customer service under my belt this wouldn't be a hard jump to make.

&#x200B;

Any advice, or opinions on this matter would be greatly appreciated."
28,Has anyone received word on the Delta training dates ? Out of curiosity how long is it and if anyone knows when the class starts around?,4,9x1anq,https://www.reddit.com/r/flightattendants/comments/9x1anq/has_anyone_received_word_on_the_delta_training/,14,2018-11-14 18:56:03,
29,"Delta F2F interview, HELP!!!",6,2m03r2,https://www.reddit.com/r/flightattendants/comments/2m03r2/delta_f2f_interview_help/,14,2014-11-11 23:58:20,"Ok so I just got my next steps interview email. And I am so excited and ready for it, but I happened to look online and saw that while the pay is around $21.50/hr thats only inflight hours. Which I was previously aware of, however what I didnt know is apparently starting you only get around 80 hours a month...what? I have an apartment and car payment and other things to take care of and at that rate i make more at my job now even though i'm not fond it. Are there any Delta flight attendants on here who can put my fears to rest?? I would LOVE the job and I dont mind relocating, but 80/hrs a month is just a no go for me. I was expecting an annual salary at $35-$44k which is about what I've seen online but that doesnt add up to that 80 hours a month pay. =(

Just an update to everyone who has been so kind as to respond, I have scheduled my f2f for next week and I plan on giving it my all and going from there =) I've decided I can handle a same temporary pay cut if it means ill be happier and use my foreign language skills more. Any f2f interview advice will be most appreciated, but until then....wish me luck!!! =D"
30,Quick question regarding shoes and F2F,3,7mg6wv,https://www.reddit.com/r/flightattendants/comments/7mg6wv/quick_question_regarding_shoes_and_f2f/,14,2017-12-27 19:59:28,"Hey, I know Delta expects heels at the F2F interview. Any insight on the heel height? Also, what are your brand preferences? I'm thinking about buying Clarks but open to suggestions. Thanks, ladies. :)"
31,Got denied Mainline Delta. When can I reapply?,3,9tybbw,https://www.reddit.com/r/flightattendants/comments/9tybbw/got_denied_mainline_delta_when_can_i_reapply/,14,2018-11-04 01:25:44,"I am in the ""archived"" ""Under Review"" which according to the website means I was declined. I am now at a regional, so I have to update my resume and reapply. I wonder when I can reapply in 2019?"
32,Got VI email from Delta!,6,9jgx6n,https://www.reddit.com/r/flightattendants/comments/9jgx6n/got_vi_email_from_delta/,14,2018-09-28 01:30:09," I got the email today from Delta (super excited to hear back so soon) and was just wondering how long it takes to get the follow up email for the VI

\-"" You will receive an email shortly with a link to begin the video interview. This email will come from Delta's trusted interview partner, HireVue. Please add @HireVue.com to your address book to ensure this email does not get caught in your spam filters ""

It's been a few hours since receiving the first email. "
33,RN to FA or BOTH?!?!,3,85v4g5,https://www.reddit.com/r/flightattendants/comments/85v4g5/rn_to_fa_or_both/,14,2018-03-20 22:33:26,"Hey ya’ll! I’m an ER nurse and am considering becoming a flight attendant on top of my current career and working both. 

I plan on finishing up my first year of nursing and then going PRN (24 hrs/month minimum) while completing my FA training and my first year since it will be all reserve flights. Then I plan on returning to my full-time nursing career (36 hrs/week = 3 x 12hr shifts) and the minimum monthly requirements for FA hours. 

Has anyone done this or is currently doing this? I love traveling, new experiences, meeting new people, and helping others. I'm a huge humanitarian and do well in chaos and under pressure. 

Also- Any opinions on Delta vs United? They are the top 2 airlines I am considering based on their hubs and routes. Or any other input for other airlines is welcome too! Looking for the best airline with the most support, friendly staff, benefits, and retirement plans. 

Thank you for any feedback :)"
34,My daughter just became a Delta FA and I'm interested in advice related to the non-rev benefits. I live in Denver which is not a hub city.,0,8mdcw1,https://www.reddit.com/r/flightattendants/comments/8mdcw1/my_daughter_just_became_a_delta_fa_and_im/,14,2018-05-27 01:48:35,
35,Applied to delta...,1,83zpvu,https://www.reddit.com/r/flightattendants/comments/83zpvu/applied_to_delta/,14,2018-03-13 03:42:12,i got the “thank you for checking in” email. how long should i wait to find out if they are going to call me to schedule a phone interview/whatever the first step is? 
36,DELTA,4,7s8lzl,https://www.reddit.com/r/flightattendants/comments/7s8lzl/delta/,14,2018-01-22 23:15:25,How long does it usually take Delta to reply when applying for a flight attendant position?
37,Delta Round 2,15,bdnzlo,https://www.reddit.com/r/flightattendants/comments/bdnzlo/delta_round_2/,14,2019-04-16 05:21:04,So I was let go of training. I made it all the way to the Boeing section that got me. What’s the likelihood of getting a second chance with them and reapplying? Do they know you made it to training and bombed in the end?
38,I need help on my Flight Attendant Resume,3,aen3io,https://www.reddit.com/r/flightattendants/comments/aen3io/i_need_help_on_my_flight_attendant_resume/,13,2019-01-10 23:28:37,"Hi everyone, I want to become a flight attendant and I see some airline is hiring: Spirit, Delta, Jetsuite, American Airlines an etc. If you have time to spare can you review my resume? 

&#x200B;

P.S. I have no flight attendant experience. "
39,I am not bilingual. Do I even have a chance of becoming a delta flight attendant?,7,4mjkuo,https://www.reddit.com/r/flightattendants/comments/4mjkuo/i_am_not_bilingual_do_i_even_have_a_chance_of/,13,2016-06-04 22:33:52,"So I'm not bilingual, but my first language was Spanish, I've just lost the ability to speak it as I've gotten older due to underuse. I still dream on fluent Spanish, though, which makes me think I'll be able to learn it quicker than average. I'm currently trying to relearn Spanish, but I'm still at the beginning stages and even if I get to a decent level I don't think speaking Spanish and English will be super helpful for someone that is applying for an American airline because there are tons of people that speak these two languages already.

I'm just feeling really down. I want to know, is it even possible to become a FA if I'm not bilingual? And if it's not, am I wasting my time by learning Spanish? I'm not doing it just to become an FA, I also want to communicate better with my family members that don't speak English, but is learning Spanish even going to be helpful in trying to get a job with an airline, specifically an international one, preferably delta? I know delta can be pretty picky with their hiring."
40,Current FA's regarding starting pay...,3,9gn7d3,https://www.reddit.com/r/flightattendants/comments/9gn7d3/current_fas_regarding_starting_pay/,13,2018-09-17 23:00:19,"Just a quick question, is it true that Southwest airline FAs get paid the most out of any other FA ? I see everywhere online that the starting pay is $39. Is this really true? Also, I heard Delta has the best reputation as the best airline to work for so how come Southwest airlines gets paid a whole $10 more. Just curious because when I looked up Southwest flights when I was going on vacation the tickets were around $230, but for Delta airlines the starting tickets was $500+, I would think because Delta receives more money in tickets, that they would pay more. Guess not, either way $28 per flight hour is still cool with me!"
